Headlines,Labels
buy indusind bank; target of rs 1400: axis direct,1
buy bajaj finance on dips: ashwani gujral,1
buy indusind bank; target of rs 2250: motilal oswal,0
"prefer indusind bank, yes bank: ashwani gujral",1
buy indusind bank; target of rs 550: firstcall research,1
top chart pick for december 28,1
"focus on hdfc, hdfc bank, hul, itc: sudarshan sukhani",0
why psbs may bridge valuation gap with private bank,0
"sell dlf, indusind bank, infosys; buy iifl, vijaya bank: thacker",1
institution of high growth to continue in indusind bank: iifl,1
buy indusind bank; target of rs 400: plilladher,1
indusind bank q2 nii likely to rise 32% at rs 675 cr,1
indusind bank inaugurate new branch in faridkot,0
check out: super six stock for december 12,1
ab money 'neurtal' on indusind bank; target of rs 1010,1
indusind bank q1 net see up 27% at rs 666.8 cr: kr choksey,1
hold indusind bank: target of rs 650: emkay,1
"buy, sell or hold: 9 stock that analysts be bullish on",0
indusind bank jun qtr pat see up at rs 181cr: krchoksey,0
"buy axis bank, yes bank, indusind bank: sudarshan sukhani",1
"buy indusind bank, jsw energy, bharat forge: ashwani gujral",1
buy indusind bank; target of rs 1966: hdfc securities,0
"buy indusind bank, advise sudarshan sukhani",1
"sell idea, m&m, tata motors; buy kesoram: ashwani gujral",0
"buy kotak bank, lloyd electric may test rs 273: prakash gaba",1
"buy indusind bank, petronet lng; sell m&m financial services: ashwani gujral",0
buy dcb bank; positive on indusind bank: ambareesh baliga,1
book some profit in indusind bank: phani sekhar,1
buy indusind bank; target of rs 600: krchoksey,1
super six short term pick for dec 13,1
baliga bullish on private sector bank,1
"buy indusind bank, raymond, cesc; hold yes bank: ashwani gujral",1
"hold indusind bank, say vishal malkan",1
"hdfc bank top pick, bob from psu space religare cap mkts",1
"indusind bank's q2 result on october 14, 2013",1
indusind bank launch qip to raise $ 215-250mn; stk up 5%,1
buy indusind bank; target of rs 2120: jm financial,1
"buy indusind bank, bata india: manas jaiswal",1
indusind bank target at rs 225: gujral,1
"sell jubilant foodworks; buy rel infra, indusind bank: gujral",0
indusind bank share sale raise usd 250 million,1
indusind bank to acquire il&fs' brokerage business,0
indusind bank q2 net profit up 130.9% at rs 77.8 cr,1
indusind bank have target of rs 320-325: thacker,1
"indusind bank q2 beat estimates, net up 32% to rs 330 cr",1
"buy century textiles, m&m, indusind bank: sudarshan sukhani",0
"buy indusind bank, national aluminium company: sandeep wagle",0
idfc see 20% return from infy in next 6 months,1
qip bonanza: indusind raise $100m via 13% stake sale,1
buy indusind bank; target rs 460: icicidirect.com,1
"below rs 394-395, indusind bank may test rs 375-380: bothra",1
indusind bank q4 net profit up 249% at rs 50.5 cr,1
hdfc bank top pick: siddharth teli,1
buy indusind bank; target of rs 700: religare capital,1
honda ink national 2wheeler retail finance mou with indusind bank,0
induslnd bank open new branch in lucknow,0
foreign investors can buy more share in indusind bank,0
"prefer yes bank, indusind bank, say kunal bothra",1
indusind bank have good support at rs 238: bhambwani,1
find out why tulsian be bullish on logistics stock,1
buy itc; sell indusind bank: sameet chavan,0
indusind-bharat financial deal: here's how experts be look at it,0
buy indusind bank; target of rs 1400: motilal oswal,1
"buy indusind bank, target rs 2248: anandrathi",0
bull's eye: 12 buy ideas for the day,1
ubs india overweight on private bank,0
buy indusind bank; target of rs 1650: jm financial,1
"bank q2: ubs securities' preview, review and pick",1
indusind bank may touch rs 445-450: kunal bothra,1
indusind bank q2 nii see up 23% at rs 407 cr,0
book profit in indusind bank at current level: sukhani,1
ing vysya bank have strong support at rs 380: gujral,1
"prefer hdfc bank, icici bank: dhananjay sinha",1
"indusind bank's q1 result on july 09, 2014",1
hold indusind bank; target of rs 234: asit c. mehta,1
"buy federal bank, indusind bank: parag thakkar",1
ashok leyland sell stake worth rs 299 crore in indusind bank,1
indusind bank sep qtr pat see up 37% at rs 182.3cr: unicon,1
indusind bank announce q2 results; pat up at rs 330.23cr,1
"after recent drubbing, here€™s how you could trade your banking, nbfc stock",1
"indusind bank's agm on august 17, 2015",1
will raise $75-100m via qips: indusind bank,1
buy indusind bank; target of rs 2120: jm financial,1
"buy yes bank, indusind bank on dips: nitin jain",1
indusind bank q1 net profit may dip 8% yoy to rs. 949.8 cr: kotak,1
"buy indusind bank, advise jitendra panda",1
super six trade stock for short term gain,1
new npas to decline 40% in fy17; prefer private sector banks: ms,1
go long in indusind bank; short biocon: rahul shah,0
bull's eye: top chart pick for today,1
fifa under 17 world cup: india knocked-out after lose 4-0 to ghana,1
indusind bank-crisil sign mou on bank loan rat,1
"prefer crompton greaves, exide, dcb, indusind bank: baliga",1
tulsian positive on axis bank,1
see lower level in indusind bank: sudarshan sukhani,0
buy indusind bank on dips; target rs 375-380: thukral,1
"short indusind bank, advise kunal bothra",0
"sell indusind bank; buy dr reddy's labs, dish tv: gaurav bissa",0
"sell indusind bank, say jitendra panda",1
"short indusind bank, say aashish tater",0
"buy stride shasun, axis bank, reliance industries: gujral",0
indusind bank a market performer: smc global,1
"buy indusind bank, lakshmi machine works: vishal jajoo",1
"buy indusind bank, jindal steel & power: mitessh thakkar",1
6 trade bet for short term gain,0
indusind bank may slip to rs 415-416: sp tulsian,0
hold indusind bank; target of rs 475: sushil finance,1
indusind bank call off deal to acquire il&fs securities service,0
indusind bank inaugurate a new branch at jamshedpur,1
pick indusind bank: gopi suvanam,1
hdfc among world's top 10 consumer financial service company,1
"sbi, hdfc bank, icici bank have upside potential: sukhani",1
indusind bank expect fy12 loan growth at 25%,1
hold indusind bank; tgt of rs 685: arihant capital market,1
"hold jsw steel; buy hdfc, indusind bank: ashish chaturmohta",1
kr choksey showcases equity portfolio for 2012,0
"indusind bank q3 result on jan 13, 2015",0
"short indusind bank, advise shardul kulkarni",1
"indusind bank look weak, say sukhani",1
indusind bank inaugurate a branch in solapur,1
buy indusind bank; target of rs 1278: reliance securities,1
"buy indusind bank, federal bank on dips: parag thakkar",1
super six trade ideas for the day,1
"indusind bank, bharat financial enter agreement to evaluate strategic share swap deal",1
prakash gaba's stock pick that can fetch handsome return,1
accumulate indusind bank; target rs 326: uljk securities,1
"buy rec, indusind bank, concor: sandeep wagle",1
"short indusind bank, bpcl; buy bharat forge: rahul shah",0
indusind bank open a new branch in indore,0
indusind bank open new branch in lucknow,0
will update on target price for indusind bank post quarter: edelweiss sec,1
6 trade stock for short term gain,0
"sell axis bank, target rs 425.50: rajat bose",0
accumulate indusind bank; tgt of rs 386: aditya birla money,1
buy indusind bank; target of rs 1734: edelweiss,1
"buy icici bank, tata motors: yogesh mehta",1
diwan`s view on indusind bank,1
"indusind bank, bharat financial board likely to meet next week to finalise merger, say romesh sobti",0
"bullish on ril, indusind bank may climb to rs 1257: rajat bose",1
"prefer axis bank, yes bank over indusind bank: tulsian",1
"pick indusind bank on correction, say sanjiv bhasin",1
buy indusind bank on breakout: sudarshan sukhani,1
indusind bank q3 net profit at rs 45.06 cr,0
no plan to raise capital in next six months: indusind bank,1
super six stock you can bet on november 22,1
credo buy 28.6 lk share in indusind bank for rs 119 cr,1
"indusind bank q4 profit see up 27%, loan growth may be healthy",0
indusind bank's pe rerating may happen soon: mehta,1
"buy l&t, havells; sell indusind bank: ashwani gujral",1
