Time,Dates,Sources,Headlines
3.56 pm , 31 Dec 2015 ,   Source: CNBC-TV18,Like private banks; SBI top pick: R Sreesankar
10.45 am , 31 Dec 2015 ,   Source: CNBC-TV18,"IndusInd Bank looks strong, may test Rs 1000: Hemant Thukral"
9.47 am , 31 Dec 2015 ,   Source: CNBC-TV18,Buy IndusInd Bank; sell BPCL: Prakash Gaba
1.45 pm , 30 Dec 2015 ,   Source: CNBC-TV18,"Go long in IndusInd Bank, says Aditya Agarwal"
9.49 am , 30 Dec 2015 ,   Source: CNBC-TV18,Short Bank of India; buy IndusInd Bank: Sukhani
8.46 am , 28 Dec 2015 ,   Source: CNBC-TV18,Top chart picks for December 28
4.34 pm , 24 Dec 2015 ,   Source: CNBC-TV18,"Pick Kotak Mah Bank, IndusInd Bank: SP Tulsian"
10.01 am , 24 Dec 2015 ,   Source: CNBC-TV18,IndusInd Bank may touch Rs 970: Rahul Mohindar
3.13 pm , 23 Dec 2015 ,   Source: CNBC-TV18,Sell Bank of India; prefer IndusInd Bank: Pankaj Jain
10.40 am , 21 Dec 2015 ,   Source: CNBC-TV18,Bank of Baroda may slip to Rs 152-155: Rajat Bose
9.49 am , 18 Dec 2015 ,   Source: CNBC-TV18,"Buy IndusInd Bank, SBI may test Rs 265: Rahul Mohindar"
9.40 am , 18 Dec 2015 ,   Source: CNBC-TV18,"Sell Axis Bank, target Rs 425.50: Rajat Bose"
9.25 pm , 16 Dec 2015 ,   Source: PTI,Dilip Shanghvi to make open offer to buy 26% Suzlon stake
10.00 am , 15 Dec 2015 ,   Source: CNBC-TV18,"Despite gloom over NPAs, these banks could be good bargains"
1.20 pm , 09 Dec 2015 ,   Source: Moneycontrol.com,IndusInd Bank opens a new branch in Indore
11.18 am , 07 Dec 2015 ,   Source: CNBC-TV18,Prakash Gaba's stock picks that can fetch handsome returns
4.11 pm , 02 Dec 2015 ,   Source: CNBC-TV18,"Sell IDFC on rallies, says Pankaj Jain"
3.20 pm , 30 Nov 2015 ,   Source: CNBC-TV18,"IndusInd Bank, HDFC Bank, SKS Micro top bets: Rahul Arora"
2.09 pm , 30 Nov 2015 ,   Source: CNBC-TV18,"Buy IndusInd Bank on dips, says Sameet Chavan"
12.21 pm , 26 Nov 2015 ,   Source: CNBC-TV18,"IndusInd Bank good pick, target Rs 953-960: Thukral"
3.16 pm , 23 Nov 2015 ,   Source: CNBC-TV18,Buy IndusInd Bank; target Rs 978: Sameet Chavan
8.57 am , 23 Nov 2015 ,   Source: CNBC-TV18,Super Six stocks that can boost your portfolio on Nov 23
2.37 pm , 20 Nov 2015 ,   Source: CNBC-TV18,"Buy IndusInd Bank, Bata India: Manas Jaiswal"
1.48 pm , 13 Nov 2015 ,   Source: CNBC-TV18,"Buy YES Bank 740 Put, IndusInd Bank 800 Put: VK Sharma"
11.54 am , 13 Nov 2015 ,   Source: Moneycontrol.com,15 quality stocks for Samvat 2072: AB Money
11.04 am , 13 Nov 2015 ,   Source: CNBC-TV18,Eyeing for gains post tie-ups with payment banks: IndusInd
7.56 am , 09 Nov 2015 ,   Source: CNBC-TV18,"Bull's Eye: Sell Dr Reddy's, JSW Energy, Ceat, buy BoI"
3.19 pm , 06 Nov 2015 ,   Source: CNBC-TV18,"Buy Motherson Sumi Systems, IndusInd Bank: Hemen Kapadia"
2.39 pm , 05 Nov 2015 ,   Source: CNBC-TV18,"Buy Coal India; sell IndusInd Bank, JSW Steel: Sukhani"
2.42 pm , 04 Nov 2015 ,   Source: Moneycontrol.com,Diwali shopping list of 12 stocks by Sharekhan
8.12 pm , 27 Oct 2015 ,   Source: PTI,IFSC at GIFT City begins operations with Yes Bank launch
11.25 am , 23 Oct 2015 ,   Source: CNBC-TV18,"Axis Bank may test Rs 530-535, says Hemant Thukral"
12.12 pm , 21 Oct 2015 ,   Source: CNBC-TV18,"Exit Tata Steel on rally, like IndusInd Bank: Rakesh Bansal"
5.10 pm , 19 Oct 2015 ,   Source: Moneycontrol.com,AB Money 'Neurtal' on IndusInd Bank; target of Rs 1010
4.36 pm , 15 Oct 2015 ,   Source: CNBC-TV18,"Money laundering scam: ICICI, OBC, Axis Bank in ED's net"
1.07 pm , 14 Oct 2015 ,   Source: Moneycontrol.com,Buy IndusInd Bank; target of Rs 1060: Firstcall
4.30 pm , 13 Oct 2015 ,   Source: Moneycontrol.com,Buy IndusInd Bank; target of Rs 1060: Firstcall research
1.05 pm , 13 Oct 2015 ,   Source: Moneycontrol.com,Accumulate IndusInd Bank; target of Rs 1070: P Lilladher
12.27 pm , 13 Oct 2015 ,   Source: Moneycontrol.com,Buy Indusind Bank; target of Rs 1050: ICICIdirect
4.34 pm , 12 Oct 2015 ,   Source: Moneycontrol.com,Hold Indusind Bank; target of Rs 1020: Edelweiss
3.56 pm , 12 Oct 2015 ,   Source: Moneycontrol.com,Buy IndusInd Bank; target of Rs 1175: Reliance Securities
5.01 pm , 09 Oct 2015 ,   Source: CNBC-TV18,"Like pharma, consumer stocks: Gautam Sinha Roy"
3.47 pm , 09 Oct 2015 ,   Source: CNBC-TV18,Six in 60: Six stocks one needs to keep an eye on
3.00 pm , 09 Oct 2015 ,   Source: CNBC-TV18,"Buy NBCC; sell Maruti, IndusInd Bank: Rajat Bose"
2.14 pm , 09 Oct 2015 ,   Source: Moneycontrol.com,"IndusInd Bank Q2 beats estimates; profit, NII jump over 30%"
12.18 pm , 09 Oct 2015 ,   Source: CNBC-TV18,Positive on IndusInd Bank: Deven Choksey
11.15 am , 09 Oct 2015 ,   Source: CNBC-TV18,Positive on private sector banks: Nischal Maheshwari
2.31 pm , 08 Oct 2015 ,   Source: CNBC-TV18,"IndusInd Bank Q2 profit, NII growth may be over 26%: Poll"
1.52 pm , 07 Oct 2015 ,   Source: CNBC-TV18,"Keep SBI, ICICI Bank, HDFC Bank in portfolio: R Sreesankar"
7.47 am , 07 Oct 2015 ,   Source: PTI,"NCDEX, Kotak Mahindra Bk pact to provide commodities loans"
1.37 pm , 06 Oct 2015 ,   Source: CNBC-TV18,Buy IndusInd Bank 940 Put: Gaurav Bissa
2.22 pm , 05 Oct 2015 ,   Source: Moneycontrol.com,Indusind Bank inaugurates a new branch at Jamshedpur
11.24 am , 01 Oct 2015 ,   Source: CNBC-TV18,"SBI, HDFC Bank, ICICI Bank have upside potential: Sukhani"
10.41 am , 01 Oct 2015 ,   Source: Moneycontrol.com,"IndusInd Bank's Q2 results on Oct 09, 2015"
3.52 pm , 30 Sep 2015 ,   Source: CNBC-TV18,"Exit SBI, invest in IndusInd Bank: Vishal Malkan"
2.17 pm , 29 Sep 2015 ,   Source: Moneycontrol.com,Accumulate IndusInd Bank; target of Rs 1080: Emkay
4.26 pm , 24 Sep 2015 ,   Source: CNBC-TV18,"Lupin, Infosys, IndusInd Bank look interesting: MOST"
5.18 pm , 23 Sep 2015 ,   Source: CNBC-TV18,"Prefer HDFC Bank, Dalmia Bharat: Mehraboon Irani"
3.00 pm , 19 Sep 2015 ,   Source: Moneycontrol.com,Diwali shopping list: 7 largecaps may give high returns
10.53 am , 18 Sep 2015 ,   Source: CNBC-TV18,"Buy IndusInd Bank 920 Call, BoB 185 Call: VK Sharma"
4.19 pm , 10 Sep 2015 ,   Source: CNBC-TV18,"HDFC Bank, Infosys top picks; like L&T, IOC: R Sreeshankar"
3.08 pm , 07 Sep 2015 ,   Source: CNBC-TV18,"Prefer Bank of Baroda, IndusInd Bank: Meghana Malkan"
3.01 pm , 07 Sep 2015 ,   Source: CNBC-TV18,"Buy HDFC Bank, IndusInd Bank: Sahil Kapoor"
2.08 pm , 05 Sep 2015 ,   Source: Moneycontrol.com,All weather stocks: 11 large caps to buy on market crash
7.34 pm , 04 Sep 2015 ,   Source: PTI,Foreign investors can buy more shares in IndusInd Bank
9.36 pm , 03 Sep 2015 ,   Source: Moneycontrol.com,IndusInd Bank: Updates on outcome of AGM
4.56 pm , 03 Sep 2015 ,   Source: CNBC-TV18,"Buy HDFC Bank, HDFC, Kotak Bank: Mehraboon Irani"
4.17 pm , 03 Sep 2015 ,   Source: CNBC-TV18,"HDFC Bank, ICICI Bank, SBI top picks: R Sreesankar"
2.55 pm , 03 Sep 2015 ,   Source: CNBC-TV18,"Buy IndusInd Bank, target Rs 930: Sahil Kapoor"
10.46 am , 03 Sep 2015 ,   Source: CNBC-TV18,Moving towards marginal cost of funding: IndusInd Bk
4.03 pm , 01 Sep 2015 ,   Source: CNBC-TV18,Prefer IndusInd Bank for long term: Parag Thakkar
11.20 am , 29 Aug 2015 ,   Source: CNBC-TV18,"Buy IndusInd Bank, Kotak Mahindra, Maruti: Sanjay Dutt"
3.28 pm , 26 Aug 2015 ,   Source: CNBC-TV18,"Sell Arvind, IndusInd Bank; buy Indraprastha Gas: Sukhani"
2.30 pm , 25 Aug 2015 ,   Source: CNBC-TV18,"Short IndusInd Bank, can move lower to Rs 800-820: MOST"
11.14 am , 25 Aug 2015 ,   Source: CNBC-TV18,"Sell IndusInd Bank, target Rs 770: Shubham Agarwal"
10.23 am , 25 Aug 2015 ,   Source: CNBC-TV18,"Buy YES Bank, IndusInd Bank, ICICI Bank on dips: Elara Cap"
4.52 pm , 20 Aug 2015 ,   Source: CNBC-TV18,"Buy YES Bank, IndusInd Bank; like ICICI Bank: Devang Mehta"
11.16 am , 19 Aug 2015 ,   Source: CNBC-TV18,"Pick IndusInd Bank, expect move to Rs 1070: ICICIdirect"
2.42 pm , 18 Aug 2015 ,   Source: CNBC-TV18,"Buy JK Tyre, IndusInd Bank: Kunal Bothra"
9.44 am , 18 Aug 2015 ,   Source: CNBC-TV18,"Hold Kotak Mahindra Bank, IndusInd Bank: Rahul Mohindar"
3.23 pm , 13 Aug 2015 ,   Source: CNBC-TV18,Buy ITC; sell IndusInd Bank: Sameet Chavan
9.06 am , 13 Aug 2015 ,   Source: CNBC-TV18,6 stocks likely to see lot of action today
9.07 pm , 12 Aug 2015 ,   Source: PTI,IndusInd raises Rs 753 crore through preferential issue
3.29 pm , 12 Aug 2015 ,   Source: PTI,"IndusInd Bk raises Rs 5,081-cr via QIP, preferential issue"
8.52 am , 12 Aug 2015 ,   Source: CNBC-TV18,Super Six trading bets that can fetch you handsome returns
3.42 pm , 06 Aug 2015 ,   Source: PTI,IndusInd Bank allots shares worth Rs 753 crore
3.25 pm , 05 Aug 2015 ,   Source: Moneycontrol.com,IndusInd Bank receives RBI approval to set up IFSC banking unit
2.09 pm , 31 Jul 2015 ,   Source: CNBC-TV18,Experts see Rs 370 as fair value for ICICI Bank
1.03 pm , 31 Jul 2015 ,   Source: CNBC-TV18,"Buy Tata Chemicals Aug futures, advises Krish Subramanyam"
11.00 am , 31 Jul 2015 ,   Source: CNBC-TV18,"Buy IndusInd Bank 980 Call, sell 1020 Call: VK Sharma"
2.49 pm , 29 Jul 2015 ,   Source: Moneycontrol.com,"IndusInd Bank's AGM on August 17, 2015"
11.56 am , 29 Jul 2015 ,   Source: CNBC-TV18,"Buy IndusInd Bank, expect move towards Rs 1000: ICICIdirect"
10.50 am , 29 Jul 2015 ,   Source: CNBC-TV18,"HDFC Bank, IndusInd better play in banking space: Sabharwal"
4.26 pm , 28 Jul 2015 ,   Source: CNBC-TV18,"Buy L&T on correction, look at Tata Motors: Dilip Bhat"
9.48 pm , 27 Jul 2015 ,   Source: PTI,IndusInd completes acquisition of RBS bullion financing biz
1.08 pm , 27 Jul 2015 ,   Source: CNBC-TV18,"Overweight on pharma, private sector banks: Dipan Mehta"
11.26 am , 27 Jul 2015 ,   Source: PTI,IndusInd completes acquisition of RBS bullion financing biz
9.44 am , 27 Jul 2015 ,   Source: Moneycontrol.com,Indusind Bank acquires Royal Bank of Scotland's Diamond & Jewellery Financing biz
1.32 pm , 21 Jul 2015 ,   Source: CNBC-TV18,"Go long in IndusInd Bank, may test Rs 1020: Uttekar"
12.16 pm , 21 Jul 2015 ,   Source: CNBC-TV18,Focus on private sector banks: Dipan Mehta
1.33 pm , 16 Jul 2015 ,   Source: Moneycontrol.com,Hold IndusInd Bank; target of Rs 976: Arihant capital
1.33 pm , 16 Jul 2015 ,   Source: Moneycontrol.com,Buy IndusInd Bank; target of Rs 1100: KRChoksey
3.20 pm , 15 Jul 2015 ,   Source: Moneycontrol.com,Buy IndusInd Bank; target of Rs 1050: ICICIdirect
3.19 pm , 15 Jul 2015 ,   Source: Moneycontrol.com,Buy IndusInd Bank; target of Rs 1200: Religare
1.27 pm , 15 Jul 2015 ,   Source: Moneycontrol.com,Accumulate IndusInd Bank; target of Rs 1050: P Lilladher
3.14 pm , 14 Jul 2015 ,   Source: Moneycontrol.com,Accumulate IndusInd Bank; target of Rs 1050: Emkay
1.07 pm , 14 Jul 2015 ,   Source: CNBC-TV18,IndusInd Bank top pick: R Sreesankar
10.43 am , 14 Jul 2015 ,   Source: CNBC-TV18,Loan growth at 23%; Q1 net slippages at Rs 7 cr: IndusInd
4.44 pm , 13 Jul 2015 ,   Source: CNBC-TV18,Look at HDFC Bank: Anand Tandon
4.26 pm , 13 Jul 2015 ,   Source: CNBC-TV18,Like DCB Bank; Axis Bank can outperform: Rahul Mohindar
2.22 pm , 13 Jul 2015 ,   Source: Moneycontrol.com,"IndusInd Bank Q1 net up 25% at Rs 525 cr, NII gains 22%"
11.06 am , 13 Jul 2015 ,   Source: CNBC-TV18,Harendra Kumar neutral on IndusInd Bank
8.50 am , 13 Jul 2015 ,   Source: Moneycontrol.com,"IndusInd Bank Q1 NIM, asset quality seen stable; NII up 22%"
3.27 pm , 10 Jul 2015 ,   Source: CNBC-TV18,"Remain invested in Voltas, says Gaurang Shah"
10.46 am , 09 Jul 2015 ,   Source: CNBC-TV18,Use dips to enter IndusInd Bank: Rahul Mohindar
9.00 am , 06 Jul 2015 ,   Source: CNBC-TV18,Super Six trading ideas for the day
10.10 pm , 03 Jul 2015 ,   Source: Moneycontrol.com,"IndusInd Bank Q1 results on July 13, 2015"
10.38 pm , 01 Jul 2015 ,   Source: PTI,IndusInd Bank-RBS deal gets Competition Commission nod
2.07 pm , 30 Jun 2015 ,   Source: CNBC-TV18,"Buy IndusInd Bank, BPCL, HUL, Kotak Bank: Hathiramani"
4.35 pm , 29 Jun 2015 ,   Source: CNBC-TV18,"Prefer HDFC Bank, Axis Bank, IndusInd Bank: Baliga"
3.23 pm , 27 Jun 2015 ,   Source: Moneycontrol.com,Portfolio churner: 10 stocks to buy/sell as Greece haunts
3.46 pm , 26 Jun 2015 ,   Source: CNBC-TV18,"Bharti Airtel may hit Rs 500, Idea Cellular Rs 230: Shah"
3.09 pm , 25 Jun 2015 ,   Source: CNBC-TV18,"TS Harihar negative on PSU banks, positive on private banks"
11.45 am , 24 Jun 2015 ,   Source: CNBC-TV18,"Look at Pidilite Industries, Kotak Bank: Saurabh Mukherjea"
2.57 pm , 22 Jun 2015 ,   Source: CNBC-TV18,"Buy TVS Motor, Century Textiles, SBI: Sudarshan Sukhani"
1.55 pm , 22 Jun 2015 ,   Source: CNBC-TV18,"Private sector banks top pick, avoid PSU banks: Dipan Mehta"
6.17 pm , 16 Jun 2015 ,   Source: PTI,Lakshmi Vilas Bank raises deposit rates by 1%
12.16 pm , 12 Jun 2015 ,   Source: PTI,IndusInd Bank promoters to retain stake at 15% post QIP
9.37 am , 12 Jun 2015 ,   Source: CNBC-TV18,"Sell IndusInd Bank, Bharat Heavy Electricals: Rajat Bose"
3.32 pm , 11 Jun 2015 ,   Source: CNBC-TV18,"Short IndusInd Bank, Allahabad Bank: Ashish Chaturmohta"
9.15 pm , 10 Jun 2015 ,   Source: Reuters,Indusind Bk in talks with banks for $750 m share sale: Srcs
4.34 pm , 09 Jun 2015 ,   Source: CNBC-TV18,"Buy IndusInd Bank, says Mehraboon Irani"
4.35 pm , 08 Jun 2015 ,   Source: CNBC-TV18,"Prefer IndusInd Bank, HDFC Bank: Ambareesh Baliga"
11.33 am , 08 Jun 2015 ,   Source: CNBC-TV18,Short IndusInd Bank; target Rs 810-815: Hemant Thukral
6.40 pm , 05 Jun 2015 ,   Source: PTI,R Seshasayee replaces KV Kamath as Infosys Chairman
9.27 am , 05 Jun 2015 ,   Source: CNBC-TV18,"Sell IndusInd Bank, target Rs 760: Shubham Agarwal"
4.54 pm , 04 Jun 2015 ,   Source: CNBC-TV18,Look at Kotak Mahindra Bank: CK Narayan
11.40 am , 04 Jun 2015 ,   Source: CNBC-TV18,"Look at HDFC Bank, DCB Bank: Ambareesh Baliga"
11.02 am , 02 Jun 2015 ,   Source: CNBC-TV18,"Buy Voltas, pick YES Bank, look at BHEL, HDIL: CK Narayan"
3.40 pm , 29 May 2015 ,   Source: CNBC-TV18,Prefer private sector banks: Gaurang Shah
3.35 pm , 22 May 2015 ,   Source: CNBC-TV18,"Exit IDBI Bank, prefer ICICI Bank: Gaurang Shah"
1.54 pm , 21 May 2015 ,   Source: CNBC-TV18,Go long in IndusInd Bank 840 Put: Gaurav Bissa
2.18 pm , 20 May 2015 ,   Source: PTI,"IndusInd Bank, Worldpay ink pact to offer services in India"
2.59 pm , 15 May 2015 ,   Source: CNBC-TV18,"Prefer Axis Bank, IndusInd Bank: Gaurang Shah"
2.48 pm , 12 May 2015 ,   Source: CNBC-TV18,"Short BHEL, IndusInd Bank: Ashish Chaturmohta"
4.36 pm , 07 May 2015 ,   Source: CNBC-TV18,"Look at PNB, IndusInd Bank: Mehraboon Irani"
4.14 pm , 07 May 2015 ,   Source: CNBC-TV18,Prefer private banks: Devang Mehta
2.49 pm , 06 May 2015 ,   Source: Moneycontrol.com,Accumulate IndusInd Bank; target of Rs 960: Sushil Finance
10.50 am , 30 Apr 2015 ,   Source: CNBC-TV18,Prefer private sector banks over PSU banks: Baliga
2.38 pm , 24 Apr 2015 ,   Source: Moneycontrol.com,Hold IndusInd Bank; target of Rs 984: Emkay
11.31 am , 22 Apr 2015 ,   Source: CNBC-TV18,"Prefer Axis Bank, IndusInd Bank: Parag Thakkar"
10.27 am , 22 Apr 2015 ,   Source: CNBC-TV18,"Sell IndusInd Bank, advises Sudarshan Sukhani"
10.25 am , 22 Apr 2015 ,   Source: CNBC-TV18,"Buy IT stocks on dips, says Parag Thakkar"
1.36 pm , 21 Apr 2015 ,   Source: CNBC-TV18,"Hold IndusInd Bank, says Mahantesh Sabarad"
11.58 am , 18 Apr 2015 ,   Source: CNBC-TV18,"Buy Lupin, Bharat Forge: CK Narayan"
5.30 pm , 17 Apr 2015 ,   Source: CNBC-TV18,"Prefer IndusInd Bank, says Mehraboon Irani"
1.56 pm , 17 Apr 2015 ,   Source: Moneycontrol.com,IndusInd Bank: Updates on outcome of board meeting
11.41 am , 17 Apr 2015 ,   Source: Moneycontrol.com,Indusind Bank appoints Yashodhan M. Kale as additional director
3.11 pm , 16 Apr 2015 ,   Source: CNBC-TV18,IndusInd’s Q4 in line; CV book guidance key: Nirmal Bang
1.56 pm , 16 Apr 2015 ,   Source: Moneycontrol.com,"IndusInd Bank Q4 profit jumps 25%, asset quality improves"
1.55 pm , 16 Apr 2015 ,   Source: Moneycontrol.com,IndusInd Bank recommends dividend of Rs 4 per share
11.02 am , 16 Apr 2015 ,   Source: CNBC-TV18,DCB Bank may hit Rs 148 in 2-3 months: Ambareesh Baliga
5.02 pm , 15 Apr 2015 ,   Source: CNBC-TV18,IndusInd Bank Q4 profit seen up 25.8% to Rs 498 cr: Poll
7.37 pm , 10 Apr 2015 ,   Source: Moneycontrol.com,Buy IndusInd Bank; target of Rs 1110: ICICIdirect
9.35 am , 10 Apr 2015 ,   Source: Moneycontrol.com,To buy RBS unit; acquisition to be EPS-accretive: IndusInd
9.29 am , 10 Apr 2015 ,   Source: Moneycontrol.com,Indusind Bank to acquire Royal Bank of Scotland's Diamond & Jewellery Financing biz in India
2.34 pm , 27 Mar 2015 ,   Source: CNBC-TV18,IndusInd Bank may hit Rs 900-910: Kunal Bothra
9.35 am , 26 Mar 2015 ,   Source: CNBC-TV18,"Short IndusInd Bank, says Sudarshan Sukhani"
3.27 pm , 18 Mar 2015 ,   Source: CNBC-TV18,Go long in IndusInd Bank: Rahul Mohindar
5.13 pm , 17 Mar 2015 ,   Source: CNBC-TV18,Look at IndusInd Bank: Rahul Mohindar
8.53 am , 13 Mar 2015 ,   Source: CNBC-TV18,Here are top 10 stocks to keep an eye on March 13
11.05 am , 12 Mar 2015 ,   Source: Moneycontrol.com,"IndusInd Bank expands presence across Chandigarh, Panipat and Mohali"
3.42 pm , 10 Mar 2015 ,   Source: CNBC-TV18,"Prefer Axis Bank, HDFC Bank, YES Bank, IndusInd Bank: Bhat"
5.07 pm , 04 Mar 2015 ,   Source: CNBC-TV18,Look at private sector banks: Parag Thakkar
11.30 am , 03 Mar 2015 ,   Source: CNBC-TV18,"Pick IndusInd Bank, Kotak Mahindra Bank: CK Narayan"
3.09 pm , 20 Feb 2015 ,   Source: CNBC-TV18,"Buy IndusInd Bank, UCO Bank: Manas Jaiswal"
12.31 pm , 19 Feb 2015 ,   Source: PTI,"IndusInd Bank to raise upto Rs 2,000cr via bonds and NCD"
11.42 am , 12 Feb 2015 ,   Source: CNBC-TV18,To invest over $1.5bn in India over 5 yrs: General Atlantic
9.33 am , 12 Feb 2015 ,   Source: CNBC-TV18,"Buy IndusInd Bank, says Sudarshan Sukhani"
9.54 am , 11 Feb 2015 ,   Source: CNBC-TV18,"Axis Bank, IndusInd Bank, Kotak Bank top picks: Thakkar"
3.39 pm , 06 Feb 2015 ,   Source: CNBC-TV18,"Exit PNB, look at ICICI Bank: Gaurang Shah"
5.15 pm , 02 Feb 2015 ,   Source: CNBC-TV18,"Buy Axis Bank, DCB Bank on declines: Ambareesh Baliga"
4.59 pm , 28 Jan 2015 ,   Source: CNBC-TV18,"Prefer Axis Bank, SBI, KPIT Tech: Parag Thakkar"
9.30 am , 28 Jan 2015 ,   Source: CNBC-TV18,Expect upside in IndusInd Bank: Sudarshan Sukhani
9.39 am , 21 Jan 2015 ,   Source: Moneycontrol.com,"IndusInd Bank may breakout, says Sudarshan Sukhani"
12.13 pm , 14 Jan 2015 ,   Source: Moneycontrol.com,Indusind Bank appoints Ranbir Singh Butola as additional director
11.10 am , 14 Jan 2015 ,   Source: CNBC-TV18,Q4 to outdo Q3; see rate cut post Budget: IndusInd Bank
2.47 pm , 13 Jan 2015 ,   Source: CNBC-TV18,"IndusInd Q3 in line, maintain buy on stock: ICICI Direct"
1.51 pm , 13 Jan 2015 ,   Source: Moneycontrol.com,"IndusInd Bank meets forecast, profit up 29% at Rs 447 cr"
11.04 am , 13 Jan 2015 ,   Source: Moneycontrol.com,IndusInd Bank Q3 PAT seen up 30% at Rs 451cr: Motilal Oswal
5.45 pm , 12 Jan 2015 ,   Source: CNBC-TV18,IndusInd Bank Q3 profit seen up 27% to Rs 443 cr: Poll
2.49 pm , 12 Jan 2015 ,   Source: CNBC-TV18,"Buy Jubilant Foodworks, IndusInd Bank: Sudarshan Sukhani"
12.53 pm , 12 Jan 2015 ,   Source: CNBC-TV18,"Q3 Preview: PSU banks will see treasury gains, says UBS"
12.11 pm , 12 Jan 2015 ,   Source: CNBC-TV18,"Prefer Axis Bank, PNB: Harendra Kumar"
6.07 pm , 09 Jan 2015 ,   Source: CNBC-TV18,"Prefer HDFC Bank, IndusInd: Rahul Mohindar"
3.10 pm , 31 Dec 2014 ,   Source: CNBC-TV18,"Buy Arvind, IndusInd Bank, Sun Pharma: Sukhani"
10.25 pm , 29 Dec 2014 ,   Source: Moneycontrol.com,"IndusInd Bank Q3 results on Jan 13, 2015"
8.12 pm , 26 Dec 2014 ,   Source: Moneycontrol.com,IndusInd Bank re-appoints Romesh Sobti as MD & CEO 
9.59 am , 24 Dec 2014 ,   Source: CNBC-TV18,Buy IndusInd Bank on breakout: Sudarshan Sukhani
3.04 pm , 19 Dec 2014 ,   Source: CNBC-TV18,"Buy IndusInd Bank, Canara Bank; sell Wipro: Rahul Mohindar"
5.04 pm , 17 Dec 2014 ,   Source: CNBC-TV18,Prefer Asian Paints for long term: Sudarshan Sukhani
2.33 pm , 11 Dec 2014 ,   Source: Moneycontrol.com,IndusInd Bank expands presence across Punjab
3.55 pm , 28 Nov 2014 ,   Source: CNBC-TV18,"Prefer Kotak Mahindra Bank, Emami: Rajesh Agarwal"
12.26 pm , 25 Nov 2014 ,   Source: CNBC-TV18,IndusInd Bank top pick; sell Syndicate Bank: Rahul Arora
10.28 am , 24 Nov 2014 ,   Source: CNBC-TV18,"Buy Federal Bank, IndusInd Bank: Parag Thakkar"
2.56 pm , 17 Nov 2014 ,   Source: Moneycontrol.com,Accumulate IndusInd Bank; target of Rs 750: ABMoney
4.55 pm , 12 Nov 2014 ,   Source: CNBC-TV18,"Pick IndusInd Bank, says Parag Thakkar"
3.41 pm , 12 Nov 2014 ,   Source: CNBC-TV18,"Prefer YES Bank, Bank of Baroda: Mayuresh Joshi"
4.29 pm , 09 Nov 2014 ,   Source: PTI,It's time we stop over-dependence on 'fickle FIIs': Parekh
7.03 pm , 03 Nov 2014 ,   Source: Moneycontrol.com,Hold IndusInd Bank; target of Rs 750: Sushil Finance
5.16 pm , 03 Nov 2014 ,   Source: CNBC-TV18,"Buy IndusInd Bank, Federal Bank on dips: Parag Thakkar"
2.05 pm , 31 Oct 2014 ,   Source: Moneycontrol.com,IndusInd Bank's director Ajay Hinduja resigns
12.27 pm , 30 Oct 2014 ,   Source: CNBC-TV18,'YES Bank posted strong Q2 nos; accumulate on stock'
1.37 pm , 20 Oct 2014 ,   Source: CNBC-TV18,IndusInd Bank may test Rs 710: Rahul Shah
3.22 pm , 17 Oct 2014 ,   Source: CNBC-TV18,"Hold IndusInd Bank, advises Kunal Bothra"
2.12 pm , 16 Oct 2014 ,   Source: CNBC-TV18,IndusInd Bank may touch Rs 660-670: Kunal Bothra
2.02 pm , 16 Oct 2014 ,   Source: CNBC-TV18,"Buy IndusInd Bank, Tata Chemicals: Kunal Bothra"
12.20 pm , 16 Oct 2014 ,   Source: CNBC-TV18,"Buy IndusInd Bank, UPL, LIC Housing Finance: Kunal Saraogi"
8.52 am , 16 Oct 2014 ,   Source: CNBC-TV18,"Bull's Eye: Buy Glenmark, HPCL, Sintex, IndusInd Bank"
4.19 pm , 14 Oct 2014 ,   Source: Moneycontrol.com,Hold IndusInd Bank; tgt of Rs 685: Arihant capital market
4.16 pm , 14 Oct 2014 ,   Source: Moneycontrol.com,Buy IndusInd Bank; target of Rs 715: KRChoksey
3.38 pm , 14 Oct 2014 ,   Source: Moneycontrol.com,Buy IndusInd Bank; target of Rs 714: ICICIdirect
2.47 pm , 14 Oct 2014 ,   Source: CNBC-TV18,"Buy Tata Power, REC, IndusInd Bank: Sudarshan Sukhani"
2.24 pm , 14 Oct 2014 ,   Source: Moneycontrol.com,Accumulate IndusInd Bank; target of Rs 690: PLilladher
2.16 pm , 14 Oct 2014 ,   Source: Moneycontrol.com,Hold IndusInd Bank; target of Rs 650: Emkay
11.16 am , 14 Oct 2014 ,   Source: CNBC-TV18,"Buy IndusInd Bank, advises Sudarshan Sukhani"
5.00 pm , 13 Oct 2014 ,   Source: CNBC-TV18,Buy IndusInd Bank at target of Rs 714: ICICI Direct
4.40 pm , 13 Oct 2014 ,   Source: CNBC-TV18,"Buy IndusInd Bank, advises Sudarshan Sukhani"
2.18 pm , 13 Oct 2014 ,   Source: Moneycontrol.com,IndusInd Bank Q2 profit up 30% to Rs 430 cr on other income
11.56 am , 13 Oct 2014 ,   Source: CNBC-TV18,"YES Bank, IndusInd to post good Q2 results: Edelweiss"
10.05 am , 13 Oct 2014 ,   Source: CNBC-TV18,IndusInd Bank Q2 profit may jump 25% to Rs 412 cr: Poll
9.52 am , 13 Oct 2014 ,   Source: Moneycontrol.com,IndusInd Bank Q2 PAT seen up 30% at Rs 430 cr: KR Choksey
9.43 am , 13 Oct 2014 ,   Source: Moneycontrol.com,IndusInd Bank Q2 PAT may rise 30.6% at Rs 431.4 cr: MOST
4.52 pm , 25 Sep 2014 ,   Source: Moneycontrol.com,Accumulate IndusInd Bank; target of Rs 625: PLilladher
4.44 pm , 24 Sep 2014 ,   Source: Moneycontrol.com,Why PSBs may bridge valuation gap with private banks
3.21 pm , 22 Sep 2014 ,   Source: CNBC-TV18,"Buy Tata Motors, IndusInd Bank: Manas Jaiswal"
1.53 pm , 19 Sep 2014 ,   Source: Moneycontrol.com,Hold IndusInd Bank: target of Rs 650: Emkay
10.33 am , 17 Sep 2014 ,   Source: CNBC-TV18,"Expect better Q2, CV loan demand to pick up in Q4: IndusInd"
10.32 am , 17 Sep 2014 ,   Source: CNBC-TV18,Dipan Mehta neutral on banking space
5.25 pm , 15 Sep 2014 ,   Source: CNBC-TV18,"Expect lower levels in YES Bank, IndusInd Bank: Sukhani"
3.29 pm , 09 Sep 2014 ,   Source: Moneycontrol.com,Indusind Bank opens new branch in Mira Road in Thane District
3.01 pm , 09 Sep 2014 ,   Source: Moneycontrol.com,Indusind Bank opens new branch at New Delhi
1.32 pm , 06 Sep 2014 ,   Source: Moneycontrol.com,Buy IndusInd Bank; target of Rs 811: IIFL
8.58 am , 02 Sep 2014 ,   Source: CNBC-TV18,"Bull's Eye: Tata Global, LIC Housing, Sarda Energy"
6.17 pm , 01 Sep 2014 ,   Source: CNBC-TV18,Buy bank stocks on dips: Parag Thakkar
3.14 pm , 01 Sep 2014 ,   Source: CNBC-TV18,Buy IndusInd Bank; target Rs 620: Kunal Saraogi
8.21 am , 28 Aug 2014 ,   Source: CNBC-TV18,Super Six trading stocks for short term gain
4.00 pm , 23 Aug 2014 ,   Source: CNBC-TV18,"Stay invested in HDFC Bank, IndusInd Bank: Sandeep Shah"
10.26 am , 20 Aug 2014 ,   Source: CNBC-TV18,Buy IndusInd Bank 570 Call: VK Sharma
8.26 am , 20 Aug 2014 ,   Source: CNBC-TV18,Super Six: Top chart picks for August 20
8.24 am , 19 Aug 2014 ,   Source: CNBC-TV18,Super Six short term picks for August 19
11.22 am , 13 Aug 2014 ,   Source: CNBC-TV18,Pick IndusInd Bank: Gopi Suvanam
5.23 pm , 08 Aug 2014 ,   Source: CNBC-TV18,"Buy HDFC Bank, sell HDFC: Gopi Suvanam"
9.51 am , 08 Aug 2014 ,   Source: Moneycontrol.com,Indusind Bank expands presence across Thane district
3.29 pm , 30 Jul 2014 ,   Source: CNBC-TV18,"Buy Century Textiles, M&M, IndusInd Bank: Sudarshan Sukhani"
8.25 am , 30 Jul 2014 ,   Source: CNBC-TV18,Super Six stocks likely to see lot of action today
8.34 pm , 25 Jul 2014 ,   Source: PTI,"RBI penalises ICICI Bank, Canara Bank, Yes Bank & 9 others"
2.49 pm , 23 Jul 2014 ,   Source: CNBC-TV18,"Buy IndusInd Bank, Lakshmi Machine Works: Vishal Jajoo"
8.15 am , 22 Jul 2014 ,   Source: CNBC-TV18,Super Six trading stocks for short term gain
2.47 pm , 21 Jul 2014 ,   Source: CNBC-TV18,"Buy Godrej Industries, M&M, IndusInd Bank: Sukhani"
