Time,Dates,Sources,Headlines
11.43 am , 18 Mar 2013 ,   Source: Moneycontrol.com,Sell IndusInd Bank Mar Fut below Rs 423; tgt Rs 409: IIFL
8.37 am , 15 Mar 2013 ,   Source: CNBC-TV18,6 trading bets that can fetch you handsome returns
2.38 pm , 11 Mar 2013 ,   Source: CNBC-TV18,"Buy HPCL, Idea, IndusInd Bank: Parag Doctor"
1.00 pm , 11 Mar 2013 ,   Source: CNBC-TV18,IndusInd Bank can retest Rs 445-450 in short term: Thukral
9.44 am , 08 Mar 2013 ,   Source: CNBC-TV18,"Short IndusInd Bank, says Sudarshan Sukhani"
10.35 am , 07 Mar 2013 ,   Source: CNBC-TV18,"Buy HDFC, HDFC Bank, Sun Pharma, says Irani"
3.54 pm , 06 Mar 2013 ,   Source: CNBC-TV18,"Buy Alembic Pharmaceutical, Dishman Pharma, NHPC: Agarwal"
8.27 am , 06 Mar 2013 ,   Source: CNBC-TV18,"Bull's eye: Buy IndusInd Bank, NHPC, SKS Micro, PFC"
8.38 am , 05 Mar 2013 ,   Source: CNBC-TV18,6 trading bets that can fetch you handsome returns
10.25 am , 04 Mar 2013 ,   Source: CNBC-TV18,Check Out: Super Six stocks for March 4 
2.00 pm , 02 Mar 2013 ,   Source: CNBC-TV18,Stick with quality stocks in confirmed uptrends: Sukhani 
12.01 pm , 02 Mar 2013 ,   Source: CNBC-TV18,"Short Aurobindo Pharma, IndusInd Bank: Sukhani"
8.30 am , 28 Feb 2013 ,   Source: CNBC-TV18,6 trading bets that can fetch you handsome returns
6.04 pm , 21 Feb 2013 ,   Source: Moneycontrol.com,Buy IndusInd Bank; target Rs 500: Motilal Oswal
7.37 pm , 20 Feb 2013 ,   Source: CNBC-TV18,"Roy bullish on ICICI Bank, HDFC Bank, Yes Bank"
8.28 am , 20 Feb 2013 ,   Source: CNBC-TV18,Super Six stocks you can bet on Feb 20
4.50 pm , 19 Feb 2013 ,   Source: Moneycontrol.com,Buy IndusInd Bank; target of Rs 625: Nirmal Bang
6.23 pm , 14 Feb 2013 ,   Source: CNBC-TV18,"Hold IndusInd Bank, says Ashu Madan"
4.29 pm , 14 Feb 2013 ,   Source: CNBC-TV18,"Add Yes Bank, IndusInd Bank: Nitin Jain"
8.34 am , 13 Feb 2013 ,   Source: CNBC-TV18,Check out: Trading ideas from 3 market experts
9.55 am , 31 Jan 2013 ,   Source: CNBC-TV18,Go long on IndusInd Bank with target of Rs 460: Thukral
9.04 am , 31 Jan 2013 ,   Source: CNBC-TV18,Super Six: Top chart picks for Jan 31
12.26 pm , 25 Jan 2013 ,   Source: CNBC-TV18,"Buy IndusInd Bank, City Union Bank, Cummins: Kapur"
8.12 am , 25 Jan 2013 ,   Source: CNBC-TV18,"Bull's eye: Buy SKS Micro, AB Nuvo; short Opto Circuits"
12.01 pm , 24 Jan 2013 ,   Source: CNBC-TV18,"Buy IndusInd Bank, Sun TV, Unitech: Kapur"
8.12 am , 24 Jan 2013 ,   Source: CNBC-TV18,"Bull's eye: Buy PNB Gilts, Unitech, Century; short RComm"
4.21 pm , 23 Jan 2013 ,   Source: CNBC-TV18,"Buy IndusInd Bank, Berger Paints, Karnataka Bank: Kapur"
8.15 am , 23 Jan 2013 ,   Source: CNBC-TV18,"Bull's eye: Buy Bajaj Finserv, Kingfisher, short HDIL"
11.18 am , 22 Jan 2013 ,   Source: CNBC-TV18,"Sell IndusInd Bank, says Sukhani"
6.09 pm , 16 Jan 2013 ,   Source: CNBC-TV18,"Buy Yes Bank, IndusInd Bank, Axis Bank on dip: Sukhani"
9.40 am , 14 Jan 2013 ,   Source: Moneycontrol.com,Buy IndusInd Bank; target Rs 486: Firstcall Research
6.18 pm , 11 Jan 2013 ,   Source: Moneycontrol.com,Accumulate IndusInd Bank; tgt of Rs 461: Aditya Birla Money
1.25 pm , 11 Jan 2013 ,   Source: Moneycontrol.com,Buy IndusInd Bank; target of Rs 500: Motilal Oswal
11.22 am , 11 Jan 2013 ,   Source: CNBC-TV18,IndusInd eyes Q4 margin growth; expects 25-50bps rate cut 
6.20 pm , 10 Jan 2013 ,   Source: Moneycontrol.com,Banks asset quality concerns to persist in Q3FY13 results
4.39 pm , 10 Jan 2013 ,   Source: Moneycontrol.com,"IndusInd Bank Dec '12 NII at Rs 1,800.49 crore"
4.14 pm , 10 Jan 2013 ,   Source: CNBC-TV18,Stay invested in IndusInd Bank: Phani Sekhar
3.40 pm , 10 Jan 2013 ,   Source: Moneycontrol.com,Buy IndusInd Bank; target of Rs 480: Prabhudas Lilladher
3.25 pm , 10 Jan 2013 ,   Source: Moneycontrol.com,Private banks to post healthy earnings growth in Q3FY13
3.14 pm , 10 Jan 2013 ,   Source: Moneycontrol.com,Accumulate IndusInd Bank; target of Rs 494: KRChoksey
2.07 pm , 10 Jan 2013 ,   Source: Moneycontrol.com,Buy IndusInd Bank; target Rs 485: Nirmal Bang
11.10 am , 10 Jan 2013 ,   Source: Moneycontrol.com,IndusInd up 2% post strong Q3 ; check broker price targets
5.10 pm , 09 Jan 2013 ,   Source: CNBC-TV18,IndusInd Bank can move to Rs 450-460: SP Tulsian
1.53 pm , 09 Jan 2013 ,   Source: Moneycontrol.com,IndusInd Bank Q3 net up 30% on higher interest income
11.00 am , 09 Jan 2013 ,   Source: CNBC-TV18,IndusInd Bank Q3 PAT seen up 32% YoY to Rs 272 cr 
5.00 pm , 08 Jan 2013 ,   Source: CNBC-TV18,"Book profit in IndusInd Bank, says Sukhani"
3.25 pm , 08 Jan 2013 ,   Source: CNBC-TV18,Buy Lakshmi Vilas Bank on correction: Sukhani
10.12 pm , 07 Jan 2013 ,   Source: Moneycontrol.com,RBI takes measures to revive corporate bond and CDS markets
3.13 pm , 02 Jan 2013 ,   Source: Moneycontrol.com,15 stock ideas for 2013: Nirmal Bang
8.51 am , 02 Jan 2013 ,   Source: CNBC-TV18,Super Six stocks you can bet on Jan 2
2.37 pm , 01 Jan 2013 ,   Source: CNBC-TV18,Buy IndusInd Bank; may rally to Rs 445-450: Kulkarni
11.48 am , 01 Jan 2013 ,   Source: Moneycontrol.com,Buy IndusInd Bank; target of Rs 500: Motilal Oswal
