Time,Dates,Sources,Headlines
10.32 am , 14 Mar 2013 ,   Source: Moneycontrol.com,Will Infosys loosen purse strings to reward shareholders?
10.45 am , 12 Mar 2013 ,   Source: Moneycontrol.com,Infosys expands footprint in Latin America
7.55 pm , 11 Mar 2013 ,   Source: CNBC-TV18,"Book profit in TCS, Infosys, HCL Tech, Wipro: SP Tulsian"
4.32 pm , 08 Mar 2013 ,   Source: CNBC-TV18,Book profit in Infosys: Mehta
4.16 pm , 07 Mar 2013 ,   Source: CNBC-TV18,Hold Infosys advises Phani Sekhar
3.25 pm , 07 Mar 2013 ,   Source: Moneycontrol.com,Accor selects Infosys CommerceEdge to drive social shopping via Facebook
3.06 pm , 07 Mar 2013 ,   Source: Moneycontrol.com,Morgan Stanley overweight on Infosys; share at 52-week high
9.32 am , 07 Mar 2013 ,   Source: CNBC-TV18,See higher levels in Infosys:  Sudarshan Sukhani
3.47 pm , 06 Mar 2013 ,   Source: CNBC-TV18,"Buy Infosys on dips, says Sukhani"
1.31 pm , 06 Mar 2013 ,   Source: CNBC-TV18,"Infosys - Big bet in IT space, says UBS India"
10.34 am , 06 Mar 2013 ,   Source: CNBC-TV18,"To focus on Europe, won't stop yearly rev guidance: Infosys"
4.12 pm , 05 Mar 2013 ,   Source: CNBC-TV18,"Infosys may decline to Rs 2650-2700, says Harchekar"
6.20 pm , 04 Mar 2013 ,   Source: Moneycontrol.com,Infosys to Add Approximately 200 Jobs to Metro Atlanta Area
4.33 pm , 01 Mar 2013 ,   Source: CNBC-TV18,Book profit in IT stocks: Sukhani 
6.57 pm , 26 Feb 2013 ,   Source: CNBC-TV18,"Buy SBI, Infosys, Bharti Airtel: Sukhani"
3.19 pm , 25 Feb 2013 ,   Source: Moneycontrol.com,Infosys likely turning the corner; up target: JP Morgan
12.01 pm , 25 Feb 2013 ,   Source: CNBC-TV18,"Buy Wipro, Infosys, says Sudarshan Sukhani"
9.47 am , 25 Feb 2013 ,   Source: CNBC-TV18,"See higher levels in Infosys, says Sukhani"
4.23 pm , 23 Feb 2013 ,   Source: CNBC-TV18,"Buy Infosys, Reliance, Bharti for next week: Sukhani"
10.38 pm , 22 Feb 2013 ,   Source: CNBC-TV18,"Arch rivals Infosys, TCS to work together on govt contract"
3.49 pm , 22 Feb 2013 ,   Source: PTI,Report of negligence in MCA 21 project 'misguided': Infosys
1.01 pm , 22 Feb 2013 ,   Source: CNBC-TV18,"Buy Infosys, Wipro: Sukhani"
9.36 am , 22 Feb 2013 ,   Source: Reuters,Ex-Infy executive aims to shake up IT sector billing model
10.52 am , 21 Feb 2013 ,   Source: Moneycontrol.com,Infosys launches BigDataEdge
2.40 pm , 20 Feb 2013 ,   Source: Moneycontrol.com,Infosys begins trading on NYSE Euronext London & Paris Markets
10.58 am , 20 Feb 2013 ,   Source: Moneycontrol.com,Infosys a leader for Oracle Applications Management Service Providers
11.52 am , 19 Feb 2013 ,   Source: Moneycontrol.com,Infosys Cloud Ecosystem Hub wins The 2012 Golden Peacock award
9.46 am , 19 Feb 2013 ,   Source: Moneycontrol.com,"Infosys to trade on NYSE Euronext London, Paris Markets from Feb 20"
9.03 am , 18 Feb 2013 ,   Source: CNBC-TV18,Check out: Super Six stocks for Feb 18 
8.38 am , 18 Feb 2013 ,   Source: Moneycontrol.com,Infosys a leader in Enterprise Mobility Services
1.13 pm , 16 Feb 2013 ,   Source: CNBC-TV18,"Buying opportunity in Infosys, says Sukhani"
2.00 pm , 15 Feb 2013 ,   Source: Moneycontrol.com,Infosys Edge wins NASSCOM business innovation
7.03 pm , 14 Feb 2013 ,   Source: PTI,Infosys gets nod for listing ADS on NYSE Euronext Paris
4.16 pm , 14 Feb 2013 ,   Source: CNBC-TV18,"Infosys can move to Rs 3050-3100, says Nitin Jain"
12.24 pm , 14 Feb 2013 ,   Source: Moneycontrol.com,Infosys' ADS approves for listing on NYSE Euronext Paris
1.44 pm , 13 Feb 2013 ,   Source: Moneycontrol.com,Infosys to partner with National ICT Australia in Joint innovation
9.42 pm , 12 Feb 2013 ,   Source: CNBC-TV18,Rolta sees order pipeline of Rs 7000cr
5.54 pm , 12 Feb 2013 ,   Source: Moneycontrol.com,Infosys to mentor British entrepreneurs after Web Mission to India
1.59 pm , 12 Feb 2013 ,   Source: Moneycontrol.com,"IT Sector exports seen up 12-14% in FY2014, says Nasscom"
7.21 pm , 11 Feb 2013 ,   Source: CNBC-TV18,"IT, pharma stocks may outperform: Sukhani"
3.59 pm , 11 Feb 2013 ,   Source: CNBC-TV18,"Short Infosys future; SL Rs 2840, target Rs 2750: Harchekar"
7.15 pm , 08 Feb 2013 ,   Source: CNBC-TV18,Dismal markets: Check out Tulsian's bets to make profits
4.04 pm , 08 Feb 2013 ,   Source: CNBC-TV18,Ambit Cap's take on IT sector after Q3 nos
10.05 pm , 07 Feb 2013 ,   Source: CNBC-TV18,Cognizant bullish on demand; sees uptick in client budgets
9.06 am , 04 Feb 2013 ,   Source: CNBC-TV18,4 stock ideas to liven up your trade
3.55 pm , 30 Jan 2013 ,   Source: PTI,Corp Affairs Min expects to soon address MCA-21 glitches
12.58 pm , 25 Jan 2013 ,   Source: PTI,"Davos 2013: IT sector to see better growth, more jobs in '13: Infy"
7.04 pm , 23 Jan 2013 ,   Source: CNBC-TV18,Growing 21% globally; optimistic on UIDAI contract: SAP
6.46 pm , 23 Jan 2013 ,   Source: Moneycontrol.com,Infosys launches AssistEdge for contact centers 
10.16 am , 23 Jan 2013 ,   Source: CNBC-TV18,"See Infosys rising closer to Rs 2,900: Manghnani"
9.52 am , 21 Jan 2013 ,   Source: CNBC-TV18,HCL Tech would continue to outperform Infosys: StanChart
3.00 pm , 17 Jan 2013 ,   Source: Moneycontrol.com,Infosys up 1% on CLSA outperform report
10.15 am , 17 Jan 2013 ,   Source: CNBC-TV18,"Sees IT stocks as trading bets, not investments: Baliga"
4.01 pm , 16 Jan 2013 ,   Source: PTI,Infosys to take over Corp Affairs Min's MCA-21 project
12.30 pm , 16 Jan 2013 ,   Source: Moneycontrol.com,"Hold Infosys; target Rs 2,881: Sushil Finance"
11.01 am , 16 Jan 2013 ,   Source: CNBC-TV18,HCL Technologies may go upto Rs 700: Manghnani
5.00 pm , 15 Jan 2013 ,   Source: Moneycontrol.com,Accumulate Infosys; target Rs 3000: Way2Wealth
4.26 pm , 15 Jan 2013 ,   Source: CNBC-TV18,Bullish on Spicejet; upbeat on Yes Bank Q3 result: Tulsian
12.32 pm , 15 Jan 2013 ,   Source: Moneycontrol.com,Buy Infosys; target of Rs 2988: Firstcall Research
11.40 am , 15 Jan 2013 ,   Source: CNBC-TV18,Infosys has target of Rs 3200: JM Financial
11.15 am , 15 Jan 2013 ,   Source: Moneycontrol.com,Infosys partners with NovaSom to significantly speed test result processing
10.33 am , 15 Jan 2013 ,   Source: CNBC-TV18,Book profits in TCS: Siddharth Bhamre
10.24 am , 15 Jan 2013 ,   Source: CNBC-TV18,Overweight on IT sector; midcap IT stocks in focus: Irani
8.22 am , 15 Jan 2013 ,   Source: Moneycontrol.com,Hold Infosys; target Rs 2940: Ventura Securities
8.08 am , 15 Jan 2013 ,   Source: Moneycontrol.com,Accumulate Infosys; target Rs 2900: Emkay
7.15 pm , 14 Jan 2013 ,   Source: CNBC-TV18,"TCS tops IT biz with all-round, consistent results: Experts"
5.00 pm , 14 Jan 2013 ,   Source: Moneycontrol.com,"TCS beats street with Q3 net profit of Rs 3551 cr, up 1%"
4.18 pm , 14 Jan 2013 ,   Source: CNBC-TV18,ONGC can touch Rs 340-350: Ambareesh Baliga
3.42 pm , 14 Jan 2013 ,   Source: CNBC-TV18,See resistance in TCS around Rs 1360-1375: SP Tulsian
3.05 pm , 14 Jan 2013 ,   Source: CNBC-TV18,TCS to add 5-7%; Infosys may rally to Rs 2950: Mohindar
2.41 pm , 14 Jan 2013 ,   Source: Moneycontrol.com,Hold Infosys; target Rs 2700: SPA Research
2.17 pm , 14 Jan 2013 ,   Source: Moneycontrol.com,Buy Infosys; target Rs 3000: P Lilladher
2.10 pm , 14 Jan 2013 ,   Source: CNBC-TV18,Infosys has target of Rs 3200: JM Financial
1.32 pm , 14 Jan 2013 ,   Source: Moneycontrol.com,Buy Infosys; target Rs 3110: Motilal Oswal
12.27 pm , 14 Jan 2013 ,   Source: Moneycontrol.com,"Infosys up further as brokerages upgrade ratings, forecast"
11.42 am , 14 Jan 2013 ,   Source: CNBC-TV18,Infosys has target of Rs 2850: Aniruddha Mehta
11.39 am , 14 Jan 2013 ,   Source: CNBC-TV18,Short Infosys above Rs 2800: Sanjay Dutt
11.21 am , 14 Jan 2013 ,   Source: CNBC-TV18,See 10% upside in Infosys: Rajen Shah
10.00 am , 14 Jan 2013 ,   Source: Moneycontrol.com,Why Credit Suisse is unimpressed by Infosys Q3 performance
9.45 am , 14 Jan 2013 ,   Source: Moneycontrol.com,Accumulate Infosys; target Rs 2850: Angel Broking
9.38 am , 14 Jan 2013 ,   Source: Reuters,Infosys rallies for second day on brokerage upgrades
9.36 am , 14 Jan 2013 ,   Source: Moneycontrol.com,Accumulate Infosys; target Rs 2875: KRChoksey
9.11 am , 14 Jan 2013 ,   Source: Moneycontrol.com,Accumulate Infosys; target Rs 3250: Dolat Capital
12.28 pm , 12 Jan 2013 ,   Source: CNBC-TV18,Is it time to shift out of TCS into Infosys? 
11.25 am , 12 Jan 2013 ,   Source: CNBC-TV18,Bullish on mkt till mid-Jan; buy Titan Indus: SP Tulsian
7.45 pm , 11 Jan 2013 ,   Source: CNBC-TV18,"Short Infosys around Rs 2710- 2715, says SP Tulsian"
6.00 pm , 11 Jan 2013 ,   Source: PTI,Wage hike for onsite workers; promotions for upto 9K: Infy
6.00 pm , 11 Jan 2013 ,   Source: Moneycontrol.com,Buy Infosys; target of Rs 3250: Dolat Capital
4.44 pm , 11 Jan 2013 ,   Source: CNBC-TV18,"Tulsian sees Nifty at 6100, bets on banks & IT"
3.55 pm , 11 Jan 2013 ,   Source: CNBC-TV18,HCL Technologies can touch Rs 800: Joshi
3.35 pm , 11 Jan 2013 ,   Source: CNBC-TV18,Buy Infosys with long-term perspective: Sukhani
2.14 pm , 11 Jan 2013 ,   Source: CNBC-TV18,Ambit Cap may up Infosys EPS estimate on strong rev growth 
1.23 pm , 11 Jan 2013 ,   Source: Moneycontrol.com,Street cheers Infosys Q3 results; here's what analysts say
1.15 pm , 11 Jan 2013 ,   Source: Moneycontrol.com,IT sectors Q3FY13 earning estimates: P Lilladher
1.07 pm , 11 Jan 2013 ,   Source: Moneycontrol.com,Buy Infosys: Prabhudas Lilladher
12.17 pm , 11 Jan 2013 ,   Source: CNBC-TV18,"Infosys, TCS, Wipro our top picks in IT: Antique Broking"
11.57 am , 11 Jan 2013 ,   Source: Moneycontrol.com,IT sector Q3FY13 earning estimates: Motial Oswal
11.12 am , 11 Jan 2013 ,   Source: Moneycontrol.com,"Infosys consolidated net profit at Rs 2369cr vs Rs 2372cr, YoY"
11.08 am , 11 Jan 2013 ,   Source: CNBC-TV18,Europe looks good; won't clip pricing to drive rev: Infosys
10.34 am , 11 Jan 2013 ,   Source: Reuters,Infosys expects FY operating margin of 26%: CFO
9.52 am , 11 Jan 2013 ,   Source: CNBC-TV18,Buy Infosys for long term: Sukhani
9.48 am , 11 Jan 2013 ,   Source: Moneycontrol.com,BSE IT Index up over 7% post Infosys ups FY13 guidance
9.25 am , 11 Jan 2013 ,   Source: Moneycontrol.com,Infosys surprises with better-than-expected Q3; guidance up
9.17 am , 11 Jan 2013 ,   Source: Moneycontrol.com,Infosys surges 10% on robust Q3 results
9.13 am , 11 Jan 2013 ,   Source: CNBC-TV18,Infosys can test Rs 2600: Anil Manghnani
9.10 am , 11 Jan 2013 ,   Source: Moneycontrol.com,Infosys surprises in Q3: Is this a turning point?
8.10 am , 11 Jan 2013 ,   Source: CNBC-TV18,"Bull's eye: Buy TVS Motor, Suzlon, CMC, short Infosys"
4.18 pm , 10 Jan 2013 ,   Source: Reuters,Infosys earnings may miss expectations
2.20 pm , 10 Jan 2013 ,   Source: CNBC-TV18,Infosys likely to reduce rev guidance to 3%: ICICI Direct
1.00 pm , 10 Jan 2013 ,   Source: CNBC-TV18,"Infosys Q3 net profit seen down 5% QoQ, USD revenue up 4%"
12.20 pm , 10 Jan 2013 ,   Source: Moneycontrol.com,Infosys Q3 PAT seen down 8% at Rs 2191cr: KRChoksey
12.04 pm , 10 Jan 2013 ,   Source: Moneycontrol.com,Infosys Q3 PAT seen down 6.4% at Rs 2216.9cr: P Lilladher
11.26 am , 10 Jan 2013 ,   Source: CNBC-TV18,Expect 120 bps fall in Infosys' margins in Q3: IIFL Inst
3.57 pm , 09 Jan 2013 ,   Source: CNBC-TV18,"M&M, Infosys can see smart upmove: SBI Cap"
12.47 pm , 09 Jan 2013 ,   Source: PTI,"LIC ups Infy's stake by over 2%, buys shares worth Rs 3k cr"
12.35 pm , 09 Jan 2013 ,   Source: CNBC-TV18,Sell Infosys 2400 Straddle ahead of results: Amit Trivedi
12.22 pm , 09 Jan 2013 ,   Source: Moneycontrol.com,Infosys Q3 PAT seen down 7% at Rs 2203.8cr: Kotak
11.46 am , 09 Jan 2013 ,   Source: Moneycontrol.com,Infosys Q3 PAT seen down 10% at Rs 2135.6cr: Motilal Oswal
10.42 am , 09 Jan 2013 ,   Source: CNBC-TV18,Infosys may slip to Rs 2100: Anil Manghnani
10.02 am , 09 Jan 2013 ,   Source: CNBC-TV18,"Buy Infosys, says Sudarshan Sukhani"
3.14 pm , 08 Jan 2013 ,   Source: CNBC-TV18,Short Larsen & Toubro: Vayalar
11.47 am , 08 Jan 2013 ,   Source: Moneycontrol.com,Infosys Q3 PAT seen down 9% at Rs 2157cr: Angel
11.12 am , 08 Jan 2013 ,   Source: CNBC-TV18,"Buy Infosys, TCS on dip: Bhamre"
11.10 am , 08 Jan 2013 ,   Source: Moneycontrol.com,Cyclically IT sector Q3 likely to be weak: Angel
1.30 pm , 07 Jan 2013 ,   Source: Moneycontrol.com,"Q3 preview: Weak client spend to hit IT, TCS seen gaining"
12.14 pm , 07 Jan 2013 ,   Source: CNBC-TV18,Stay invested in Infosys: Sukhani
11.33 am , 07 Jan 2013 ,   Source: CNBC-TV18,UBS India neutral on Infosys
2.15 pm , 05 Jan 2013 ,   Source: Moneycontrol.com,"Indian IT to do better in FY14, bet on HCL Tech: Goldman"
7.38 pm , 04 Jan 2013 ,   Source: CNBC-TV18,Infy Q3 results unlikely to be strong; but good buy: Tandon
3.40 pm , 04 Jan 2013 ,   Source: CNBC-TV18,"Buy Bharti Airtel, Infosys, RIL: Sukhani"
3.17 pm , 04 Jan 2013 ,   Source: PTI,Under-performers asked to leave may be less than 5000: Infy
10.20 am , 04 Jan 2013 ,   Source: Reuters,"Infosys to fire up to 5,000 workers: Report"
9.05 am , 04 Jan 2013 ,   Source: CNBC-TV18,Super Six stocks you can bet on Jan 4
6.58 pm , 03 Jan 2013 ,   Source: Moneycontrol.com,Infosys prize 2012 honors finest minds in Science and Humanities
9.58 am , 03 Jan 2013 ,   Source: Moneycontrol.com,Infosys rises on Bank of America buy report
9.44 am , 02 Jan 2013 ,   Source: CNBC-TV18,2013 opens with optimism tinged with caution: CII
6.08 pm , 31 Dec 2012 ,   Source: CNBC-TV18,"Infosys may slip to Rs 1975-2000, says Baliga"
11.08 am , 29 Dec 2012 ,   Source: Moneycontrol.com,Mid-tier IT firms outperform big boys in 2012
7.55 pm , 28 Dec 2012 ,   Source: CNBC-TV18,"Buying opportunities seen in Infosys, Wipro: Sukhani"
5.00 pm , 28 Dec 2012 ,   Source: Moneycontrol.com,Year 2013: 11 stocks that can give you handsome returns 
2.24 pm , 28 Dec 2012 ,   Source: Reuters,Tata Motors best blue-chip performer in 2012
9.11 am , 28 Dec 2012 ,   Source: CNBC-TV18,"Go long in Infosys, says Sudarshan Sukhani"
2.32 pm , 27 Dec 2012 ,   Source: CNBC-TV18,"Agarwal advises to sell Infosys, TCS"
1.13 pm , 27 Dec 2012 ,   Source: CNBC-TV18,"Buy Apollo Tyres, TCS, Infosys: Sukhani"
9.29 am , 27 Dec 2012 ,   Source: Moneycontrol.com,Sell Infosys Jan Fut below Rs 2360: IIFL
10.27 pm , 26 Dec 2012 ,   Source: PTI,Infosys to announce Q3 results on Jan 11
7.37 pm , 26 Dec 2012 ,   Source: CNBC-TV18,Anand Tandon overweight IT sector
1.34 pm , 26 Dec 2012 ,   Source: Moneycontrol.com,"Infosys Q3 results on Jan 11, 2013"
6.28 pm , 24 Dec 2012 ,   Source: Moneycontrol.com,"Infosys cutting prices to boost volumes, says JP Morgan"
10.51 am , 24 Dec 2012 ,   Source: PTI,'SCAM' to make 2013 a promising year for IT-BPO sector
10.34 am , 22 Dec 2012 ,   Source: Moneycontrol.com,Heads up! Stocks you should trade next week
12.42 pm , 21 Dec 2012 ,   Source: CNBC-TV18,"Short term traders don’t buy Infosys, TCS, Wipro: Sukhani"
10.09 am , 21 Dec 2012 ,   Source: CNBC-TV18,"Buy Infosys around Rs 2300, says Sunidhi Securities"
12.54 pm , 20 Dec 2012 ,   Source: Moneycontrol.com,"Buy Infosys Jan fut, sell Nifty Jan fut: ICICIdirect"
9.54 am , 20 Dec 2012 ,   Source: CNBC-TV18,"Infosys a good medium term bet, says Atul Badkar"
3.20 pm , 19 Dec 2012 ,   Source: PTI,IT would like RBI to look at interest rates: Infosys
8.25 am , 19 Dec 2012 ,   Source: CNBC-TV18,Six intraday top picks for December 19
4.37 pm , 18 Dec 2012 ,   Source: Moneycontrol.com,Infosys FinacleTM a leader among Global Banking Platforms
5.39 pm , 17 Dec 2012 ,   Source: CNBC-TV18,Ambareesh Baliga negative on IT space
2.09 pm , 17 Dec 2012 ,   Source: Reuters,Infosys may trim forecast again as US clients cut back
7.40 pm , 14 Dec 2012 ,   Source: PTI,Ex-employee withdraws lawsuit against Infy after settlement
12.04 pm , 14 Dec 2012 ,   Source: PTI,Japan's OSG selects Infosys CommerceEdge platform
8.47 am , 14 Dec 2012 ,   Source: Moneycontrol.com,OSG Corp selects Infosys CommerceEdge to transform its e-commerce portal
8.35 pm , 13 Dec 2012 ,   Source: PTI,Indian cos invest USD 2.31 billion overseas in November
6.48 pm , 13 Dec 2012 ,   Source: PTI,Infosys is number one for corp governance: Report
5.34 pm , 13 Dec 2012 ,   Source: CNBC-TV18,US likely to launch 4 big I-T deals
3.01 pm , 13 Dec 2012 ,   Source: Moneycontrol.com,Infosys ranks No. 1 for its corporate governance
8.51 am , 13 Dec 2012 ,   Source: Moneycontrol.com,Infosys ADS starts trading on NYSE
9.21 pm , 12 Dec 2012 ,   Source: CNBC-TV18,"Europe strategic for Infy, London & Paris listing next: CEO"
11.44 am , 12 Dec 2012 ,   Source: CNBC-TV18,Buy Infosys 2300 Put: VK Sharma
9.17 am , 12 Dec 2012 ,   Source: CNBC-TV18,"Short Infosys, says Sudarshan Sukhani"
9.21 pm , 07 Dec 2012 ,   Source: CNBC-TV18,Infosys may lower FY13 dollar guidance
1.22 pm , 07 Dec 2012 ,   Source: Reuters,Infosys FY13 revenue outlook under threat: UBS
12.18 pm , 07 Dec 2012 ,   Source: Moneycontrol.com,Infosys BPO wins 2012 Optimas Award for Managing Change
6.21 pm , 06 Dec 2012 ,   Source: PTI,Infosys plans to roll out project for India Post in 2 yrs
3.58 pm , 06 Dec 2012 ,   Source: CNBC-TV18,Stay away from Infosys: Sukhani
12.16 pm , 06 Dec 2012 ,   Source: Reuters,IT shares shares extend fall on outlook worries
12.08 pm , 06 Dec 2012 ,   Source: Moneycontrol.com,Buy Infosys; target of Rs 2575: Emkay
11.21 am , 06 Dec 2012 ,   Source: CNBC-TV18,Infosys can re-test Rs 2275: Hemant Thukral
5.15 pm , 05 Dec 2012 ,   Source: PTI,Facebook to replace Infosys on Nasdaq 100 next Wednesday
1.27 pm , 05 Dec 2012 ,   Source: CNBC-TV18,"Infy downgrade on no mgmt initiative, dull economy: Cowen"
10.32 am , 05 Dec 2012 ,   Source: Moneycontrol.com,Infy falls 2% after losing pride of place in Nasdaq 100
6.56 pm , 30 Nov 2012 ,   Source: PTI,Infosys plans to list ADS on NYSE Euronext
6.50 pm , 30 Nov 2012 ,   Source: Moneycontrol.com,Infosys plans to list its ADS on NYSE Euronext
4.56 pm , 29 Nov 2012 ,   Source: CNBC-TV18,"Diwan upbeat on RIL, Infosys, Natco Pharma"
4.21 pm , 29 Nov 2012 ,   Source: Moneycontrol.com,Infosys named a leader in IDC MarketScape
8.56 am , 27 Nov 2012 ,   Source: CNBC-TV18,Check out stocks for short term gain
12.10 pm , 24 Nov 2012 ,   Source: CNBC-TV18,No acquisition plans in China; positive on Europe ops: TCS
5.09 pm , 22 Nov 2012 ,   Source: PTI,IT sector likely to grow at 11% this fiscal: Infosys
12.37 pm , 21 Nov 2012 ,   Source: CNBC-TV18,See IT sector growth closer to 11% in FY13: NASSCOM
9.04 am , 21 Nov 2012 ,   Source: CNBC-TV18,6 intraday picks to make smart gains
3.31 pm , 19 Nov 2012 ,   Source: Moneycontrol.com,Infosys launches 'India in a Box' for Japanese companies
11.09 am , 19 Nov 2012 ,   Source: CNBC-TV18,"Buy Infosys on dips, says Hemant Thukral"
9.32 am , 19 Nov 2012 ,   Source: CNBC-TV18,6 trading stocks for short term gain
2.45 pm , 16 Nov 2012 ,   Source: CNBC-TV18,Infosys may rally to Rs 2420-2450: Kulkarni
8.30 am , 15 Nov 2012 ,   Source: Moneycontrol.com,"Infosys, Microsoft, Gen-i partner to simplify Australian Cloud deployments"
5.34 pm , 12 Nov 2012 ,   Source: Moneycontrol.com,Buy or sell: Emkay's trading tips for Mahurat trading
9.30 am , 09 Nov 2012 ,   Source: Moneycontrol.com,Infosys signs $ 50 mn contract with MCA; stock trades lower
7.38 pm , 08 Nov 2012 ,   Source: PTI,Infosys bags about USD 50m deal from MCA
7.23 pm , 08 Nov 2012 ,   Source: Moneycontrol.com,Infosys signs multi-year agreement with Ministry of Corporate Affairs
4.39 pm , 08 Nov 2012 ,   Source: CNBC-TV18,"Buy Tata Motors, Infosys, TCS: Sukhani"
10.16 pm , 07 Nov 2012 ,   Source: CNBC-TV18,"Indian IT cos cheer Obama's victory, but visa still a worry"
10.01 pm , 07 Nov 2012 ,   Source: PTI,Cognizant maintains lead over Infosys; revenue at USD 1.9bn
10.09 am , 07 Nov 2012 ,   Source: Moneycontrol.com,Lloyd's Register Group selects Infosys as Global Information System Transformation Partner
8.00 pm , 06 Nov 2012 ,   Source: PTI,RBS acquires 29 lakh shares in 8 cos for Rs 352 cr
1.02 pm , 06 Nov 2012 ,   Source: PTI,No donation given to Kejriwal for political work: Murthy
1.43 pm , 05 Nov 2012 ,   Source: CNBC-TV18,"TCS downgraded to 'sell'; bet on Infy, HCL: CLSA"
8.32 am , 02 Nov 2012 ,   Source: Reuters,"Wipro Q2 profit rises 24%, beats estimates"
9.52 am , 01 Nov 2012 ,   Source: CNBC-TV18,"Atul Badkar bullish on Bharti Airtel, Infosys"
3.02 pm , 24 Oct 2012 ,   Source: PTI,"'Airtel, Infosys, TCS among most sought after employers'"
3.32 pm , 22 Oct 2012 ,   Source: Moneycontrol.com,Buy Infosys; target of Rs 2686: Firstcall Research
11.12 am , 22 Oct 2012 ,   Source: Moneycontrol.com,Analysts raise TCS target price after strong Q2
10.34 am , 22 Oct 2012 ,   Source: CNBC-TV18,Antique's view on IT sector post Q2 earnings
6.02 pm , 19 Oct 2012 ,   Source: Moneycontrol.com,TCS tops expectations with 44% YoY rise in Q2 net profit
12.49 pm , 19 Oct 2012 ,   Source: CNBC-TV18,"TCS, Wipro, Mindtree: Who will steal the show in Q2?"
6.55 pm , 17 Oct 2012 ,   Source: Moneycontrol.com,Infosys wins 2012 Microsoft platform modernization award
5.17 pm , 17 Oct 2012 ,   Source: PTI,IT space needs new products to meet $300bn target: Infosys
3.30 pm , 16 Oct 2012 ,   Source: Moneycontrol.com,Hold Infosys; target of Rs 2565: R K Global
12.56 pm , 16 Oct 2012 ,   Source: Moneycontrol.com,Reduce Infosys; target of Rs 2352: KRChoksey
11.31 am , 16 Oct 2012 ,   Source: Moneycontrol.com,Buy Infosys; target of Rs 2800: Motilal Oswal
7.11 pm , 15 Oct 2012 ,   Source: CNBC-TV18,"Infosys an underperformer, may slip to Rs 2200: Baliga"
2.02 pm , 15 Oct 2012 ,   Source: CNBC-TV18,"After dismal Infy Q2 results, will other IT cos click? "
12.05 pm , 15 Oct 2012 ,   Source: Moneycontrol.com,Accumulate Infosys; target of Rs 2573: Angel Broking
12.02 pm , 15 Oct 2012 ,   Source: Moneycontrol.com,Buy Infosys; target of Rs 2900: PLilladher
9.49 am , 15 Oct 2012 ,   Source: CNBC-TV18,"Buy Infosys on dips, says Sudarshan Sukhani"
11.01 am , 13 Oct 2012 ,   Source: Moneycontrol.com,Hold Infosys; target of Rs 2700: SPA Research
11.00 am , 13 Oct 2012 ,   Source: Moneycontrol.com,Reduce Infosys; target of Rs 2357: Asit C. Mehta
10.50 am , 13 Oct 2012 ,   Source: Moneycontrol.com,Accumulate Infosys; target of Rs 2710: Dolat Capital
10.45 am , 13 Oct 2012 ,   Source: Moneycontrol.com,Accumulate Infosys; target of Rs 2575: Emkay
7.12 pm , 12 Oct 2012 ,   Source: CNBC-TV18,Buy Infosys at current levels: Dipan Mehta
4.58 pm , 12 Oct 2012 ,   Source: Moneycontrol.com,How do analysts view Infosys Q2 results?
3.28 pm , 12 Oct 2012 ,   Source: PTI,Infosys to raise salaries of Indian employees by 6%
3.13 pm , 12 Oct 2012 ,   Source: Moneycontrol.com,Infosys may slip to Rs 2220-2240: Murlidharan
1.55 pm , 12 Oct 2012 ,   Source: Moneycontrol.com,Is Infosys grooming CFO Balakrishnan for the top job?
12.14 pm , 12 Oct 2012 ,   Source: Moneycontrol.com,"Infosys retains margin guidance, sees challenging times  "
11.33 am , 12 Oct 2012 ,   Source: CNBC-TV18,Need stability on management side of Infy biz: Moshe Katri
11.12 am , 12 Oct 2012 ,   Source: Reuters,Infosys shares recoups losses after clarification
11.08 am , 12 Oct 2012 ,   Source: CNBC-TV18,"Infy Q2 disappoints, stock to settle at Rs 2200-2300: IIFL"
10.52 am , 12 Oct 2012 ,   Source: Moneycontrol.com,Infosys board declares interim dividend of Rs 15
10.52 am , 12 Oct 2012 ,   Source: Moneycontrol.com,Infosys cons Q2 net profit at Rs 2369 crore versus Rs 1906 crore
10.09 am , 12 Oct 2012 ,   Source: Moneycontrol.com,"Infosys Q2: Management views on pricing, deals, clients, guidance"
10.08 am , 12 Oct 2012 ,   Source: CNBC-TV18,"Infosys Q2: Stock may slip to last quarter lows, cautions Nilesh Shah"
10.01 am , 12 Oct 2012 ,   Source: CNBC-TV18,"Infosys Q2: Looks like biz is under serious pressure, says Kotak Instl"
9.46 am , 12 Oct 2012 ,   Source: Moneycontrol.com,"TCS, HCL Tech, Wipro open lower post Infosys results"
9.26 am , 12 Oct 2012 ,   Source: Moneycontrol.com,"Bala to head Infosys BPO arm, Finacle; Bansal to be new CFO"
9.17 am , 12 Oct 2012 ,   Source: Moneycontrol.com,"Infosys Q2 results inline, Bala to head BPO arm; stk slips"
9.16 am , 12 Oct 2012 ,   Source: Reuters,Expert views on Infosys Q2 results
8.43 am , 12 Oct 2012 ,   Source: Moneycontrol.com,Infosys Q2 net up 24% YoY; shrs sink on poor guidance
3.12 am , 12 Oct 2012 ,   Source: Reuters,Infy net to up 25% as global clients look to squeeze costs
7.08 pm , 11 Oct 2012 ,   Source: CNBC-TV18,"Infosys may rally to Rs 2700, says Kulkarni"
2.28 pm , 11 Oct 2012 ,   Source: Moneycontrol.com,Don't take fresh call in Infosys: Rikesh Parikh
1.27 pm , 11 Oct 2012 ,   Source: Moneycontrol.com,Exit Infosys at current level: Merani
12.28 pm , 11 Oct 2012 ,   Source: CNBC-TV18,Infosys Q2 EBIT seen up 6% at Rs 2854 cr
11.59 am , 11 Oct 2012 ,   Source: Moneycontrol.com,Will Infosys cut FY13 EPS guidance?
11.40 am , 11 Oct 2012 ,   Source: Moneycontrol.com,Infosys Q2 PAT seen up 4% at Rs 2386cr: Emkay
11.35 am , 11 Oct 2012 ,   Source: Moneycontrol.com,Infosys Q2 PAT seen up 1% at Rs 2314cr: Angel Broking
11.27 am , 11 Oct 2012 ,   Source: Moneycontrol.com,Infosys Q2 PAT seen up 4.9% at Rs 2401cr: MOSt
11.24 am , 11 Oct 2012 ,   Source: CNBC-TV18,Infy may revise EPS guidance to Rs 164 for FY13: Kotak
11.17 am , 11 Oct 2012 ,   Source: Moneycontrol.com,Infosys Q2 PAT seen up 4% at Rs 2377 cr: KRChoksey
11.07 am , 11 Oct 2012 ,   Source: Moneycontrol.com,Infosys Q2 PAT seen dn 0.4% at Rs 2279cr: ICICI Direct.com
10.56 am , 11 Oct 2012 ,   Source: Moneycontrol.com,Infosys Q2 PAT seen up 6.6% at Rs 2439cr: Kotak Securities
