Headlines,Labels
initial interest will be in main line scrips: mathew,0
stay away from infosys technologies: mohoni,0
"prefer tcs over infosys, wipro: mehraboon irani",1
kawaljeet saluja positive on infosys,1
pn vijay`s view on it space,1
switch to infosys than patni computer: pujara,1
"infosys q3 profit see up 1.9%, cy15 cue key to watch: poll",0
infosys q1 net at rs 1079cr; fy08 eps see at rs 78.20-79,1
infosys may test rs 4070-4100: amit harchekar,1
here be top 10 stock to focus on march 31,1
bar to buy control stake in hexaware for $420 mn,0
"decode infy's real problem: too much cash, little dash",1
long on tcs for target of rs 1580-1590: mithil pradhan,0
"it stock benefit from rupee fall, but for how long?",0
"expect 3-4% rally in infosys, say chandan taparia",1
infosys may gain 10% in 3-4 months: pn vijay,1
"fewer jobs, more layoffs: why pace of hire have slow in indian it",0
"limit upside in infosys, say baliga",0
"infosys to open technology, innovation hub in arizona; hire 1,000 people by 2023",1
infy fy08 eps guidance up 22% at rs 81,0
hold infosys; target of rs 1200: arihant capital,1
teamlease & rajasthan govt organize livelihood mela,0
hold infosys; target rs 2945: r k global,0
buy infosys technologies: p-sec,1
it sector face shortage of quality engineer,0
tcs's chandra hint 2% dip in fy16 constant currency growth,0
indian it cos fully compliant with us visa norms: nasscom,1
"buy aurobindo pharma, infosys: sudarshan sukhani",0
"buy infosys on dips, say sudarshan sukhani",1
infosys q4 result disappoint: key highlight,1
infosys submit settlement application with sebi over rajiv bansal's severance pay,0
"hcl tech beat street; q3 net jump 73% yoy to rs 1,040cr",1
buy infosys tech; target of rs 3400: motilal oswal,1
infy mid mgmt thin due to growth: basab pradhan,0
"buy hdfc, yes bank, hdfc bank: sudarshan sukhani",0
tcs vs infosys vs wipro: key q4 number in one chart,1
it cos may report sequential topline growth in q2,1
"buy infosys, hold till november: sudarshan sukhani",1
"wipro focus on strong profitable growth, say azim premji",0
buy infosys; target of rs 2700: khandwala,1
us law firm file class action suit won€™t impact buyback: v balakrishnan,1
top 15 company you should keep an eye on: pinc research,1
see low revenue growth of 9-10% for india inc in q2: crisil,1
"q2fy12: optimistic infy see no budget cuts, better price",0
infosys q2 fy19 review: steady execution; an ideal long term buy,1
infosys fy14 revenue guidance may be raised: poll,0
bpo attrition rat less steep in small towns,1
sell infosys if it move to rs 2250: bose,0
"prefer hcl technologies, say gaurang shah",0
invest in infosys at current level: bhat,1
infosys have support at rs 3175-3183: thacker,1
infosys complete acquisition of brilliant basics,1
infosys outlook look good; eye 8-10% sales growth: cowen,1
"see higher level in infosys, say sukhani",0
sell infosys future; target of rs 1750: iifl,1
"indian it on see saw: tcs, hcl tech lead in q4",0
"buy infosys, voltas, yes bank: sudarshan sukhani",0
attrition to recede; us bank cautious on it spend: sikka,0
see higher level in infosys: sudarshan sukhani,1
infosys bet big on engineer service,1
"short infosys, target rs 1020: rahul mohindar",1
bangalore techies in panic mode as it company shed workforce,0
"balakrishnan pitch for nilekeni, nrn or premji for cio post",1
"buy it stocks, say pn vijay",0
infosys co-founder murthy plan india jv with amazon: paper,0
"prefer tcs, infosys to wipro: thunuguntla",1
"s&p up tcs, infosys, wipro credit rat to a from bbb+",0
6 stock ideas to liven up your trade,1
be pai's exit reason for rs 18500cr mkt cap loss for infy?,1
"bullish on infosys, buy call option: sukhani",0
get subpoena from us court on visas: infosys,1
"now, wipro mull share buyback, plan use 25-30% of cash: srcs",0
infosys likely to see knee-jerk reaction on monday; 10 key takeaways from q4 result,1
"infosys q1 profit fall 6.8%, raise fy20 constant currency revenue guidance to 8.5-10%",0
"exit zen technologies, say shah",0
"buy infosys, target rs 784: rajesh palviya",1
"prefer tcs, infosys, wipro, hcl tech to satyam",1
infosys fy09 revenues see at usd 4.67 bn,0
it expansion plan for tamil nadu,0
"tcs, infosys best bet in it space: brics securities",0
"2018 will be a better year for indian it, say industry figure",1
six stock that should do well today,1
sell infosys 2400 straddle ahead of results: amit trivedi,1
book profit in ril at rs 883: manghnani,1
hcl tech lag profit forecast; see jump in deal pipeline,1
"sell ambuja cements, hindustan unilever; buy dhfl: gujral",1
"buy infosys 2050 call, axis bank 580 call: vk sharma",0
infosys a good bet rs 1400: choksey,0
"prefer tcs, infosys, tech mahindra, hexaware: dilip bhat",0
f&o strategies for the day,0
"hold infosys, say rajesh jain",0
"emkay's view on infosys, tcs, wipro, hcl tech",0
upside cap in infosys technologies: nilesh shah,1
"recovery in sight, clients more confident: infosys",1
infosys' 4th software development centre inaugurate today,0
"infosys severance pay plea: matter of legality for sebi, not emotions: ex-cfo",0
"it cos use technology to boost staff morale, keep update",1
mayuresh joshi expect earn to drive mkt; pick 12 bet,1
"sell infosys december future; target rs 2,668: iifl",0
infosys technologies declare final dividend of rs 20 per share,1
"infosys rejig to sharpen focus on clients, sales effectiveness",0
infosys technologies may slip to rs 2000: gaba,1
"after cognizant, wipro, now infosys to lay off employees",1
buy infosys; target of rs 1175: systematix,0
infosys boss shibulal take 26.5% salary cut in fy13,1
"look at tcs, wipro, infosys: mayuresh joshi",1
infy headcount additions to be strong in fy12: cowen & co,1
"tcs commentary on clients budget key; buy infy, hcl: edelweiss",0
"infosys, lakshmi machine top trade picks: gepl capital",0
"infosys: great start to the year, a strong buy",0
bg srinivas tip to join another it firm as ceo & md,1
'infy's newly constitute board will take on any challenge',1
infosys may go upto rs 2350-2400: kulkarni,0
revenue impact by rs 287 cr due to re rise: infosys,1
"hold infosys; exit pantaloon, jspl: sukhani",0
emirates get set for bangalore,0
infosys surprise d-street! top 10 takeaways for june quarter result,1
realty firm see firm it sector demand,0
infosys see higher attrition at junior level,1
infosys may test rs 2520: jai bala,0
buy infosys; target of rs 1100: motilal oswal,0
"look at axis bank, yes bank, sun pharma: mayuresh joshi",1
infosys may slip to rs 2650: thacker,0
buy infosys technologies; target of rs 3664: motilal oswal,0
look at smaller acquisitions: infosys,1
f&o strategy on infosys,0
lupin have target of rs 530: pankaj pandey,0
infosys consider rs 500-600 crore expansion plan,0
"prefer infosys, sun pharmaceutical: jitendra sriram",1
"short infosys, say sudarshan sukhani",1
wipro signal demand pick-up after profit rise,1
"tcs follow infosys; lower q4 margins, revenue estimate",1
infosys may guide to 8-9% growth for fy14: rajgarhia,1
infosys can move upto rs 1850,0
ril regain lose glory; pip cil as most-valued firm,0
"buy aurobindo pharma 760 call, pick infosys: vk sharma",1
"buy sparc, idea cellular; sell upl: ashwani gujral",0
"buy infosys, allahabad bank: mitessh thakkar",0
"satyam, tcs, infosys can add 25-30%",0
"buy tcs at rs 1300-1350, say rajesh agarwal",1
infosys to consider buyback of equity share,1
buy infosys; target of rs 2945: r k global,0
f&o strategies for the day,0
infosys technologies can test rs 3000: gujral,0
expect correction in infy: dipan mehta,0
"stay invest in infosys, say neeraj deewan",0
infosys bid farewell to co-founder kris gopalakrishnan,0
buy infosys technologies; tgt of rs 3100: pinc research,1
"diwan upbeat on ril, infosys, natco pharma",1
polaris can add another rs 15,0
"prefer textile, pharma, it space: deepak shenoy",0
infosys to invest rs 50 cr more in kerala centre,1
"buy hero motocorp, infosys; sell jet airways: sudarshan sukhani",0
"infosys q1 net fall 3.5%, fy15 $ revenue to grow 7-9%",1
company focus on big acquisitions for growth: infosys,1
buy infosys for long term: sukhani,0
inability to read result can pull down infy,0
cognizant to hire aggressively this year: ceo,0
no risk in add infosys even at current level,1
infosys an outperformer: clsa,0
prefer infosys at lower levels: kunal bothra,1
it stock may underperform: deven choksey,0
"buy infosys 3800 call, sell two 3900 calls: amit trivedi",1
"hold short position in infosys, tcs, wipro: bhamre",0
"resign be one of the hardest decisions, but have to be done, say vishal sikka",0
vibrant india take over new york,1
"keep it, pharma stock in portfolio: ajay bagga",0
"stay away from wipro, satyam: mohindar",1
infosys struggle to retain talent at mid & junior level,0
change at infosys will take time to show results: aberdeen,1
"infosys can add rs 100, say baliga",0
infosys increase investment in emea,1
ramalinga raju's salary be lowest among peers!,0
"infosys' manufacturing, finance head exchange roles",0
infosys have resistance at rs 1500-1600: s agarwal,1
rajasthan unveil new it & ites policy,1
infy result a benchmark for other tech cos: nilesh shah,0
infosys to strengthen its leadership programme to boost internal hire,0
see no change in infosys fy15 $ guidance of 7-9%: ambit cap,0
"stay invest in infosys, say mehta",0
"infosys saga: please that nandan nilekani be back, say nrn murthy",1
infosys tech unveil latin america it development center,1
"infosys may slip to rs 2500, say sukhani",1
infosys can touch rs 2829: gaba,1
march quarter will be stronger for us than dec: mindtree,0
infosys may slip to rs 2620-2630: sukhani,0
infosys announce share buyback: here's how experts view it,1
infosys' jun qtr pat see down 7% at rs 1689 cr,0
"infosys q1 profit fall 4.5%, cut fy17 dollar revenue guidance",1
infy mgmt do commendable job on margins: phillip capital,1
"bharti airtel, infosys may see further decline: sukhani",1
iji organize workshop on origami,1
infosys pursue 15 global deal worth $100 m each,0
it job creation not root in reality: head hunters india,1
as-11 not an overload but a necessity: infosys,1
"bullish on infosys in long term, say prakash diwan",1
"buy pfc, infosys, bharti airtel; sell unite breweries: sukhani",0
murthy's return signal admission of failure by infy,1
"buy infosys, hcl tech, mindtree on correction: baliga",1
"sell infosys, advise rajesh agarwal",1
book profit in infosys at rs 2650: sp tulsian,0
infosys have support at rs 1300: sukhani,1
ibm study say average yearly cost of data breach in indian company close to rs 13 crore,0
"buy infosys on declines, say ambareesh baliga",0
"buy infosys, say sudarshan sukhani",1
indian it firm to meet trump officials on visa reform concern,0
"infosys to announce q2 result on october 24, 2017",1
it industry to see volatility in revenues next yr: infosys,0
"bofa-ml upgrade infosys, tech mahindra to 'buy'",0
go long in infosys: siddharth bhamre,1
stay invest in infosys technologies: jain,1
"avoid it stocks, say sukhani",1
infosys can add rs 400-500,0
it pack look interest,1
v balakrishnan bat for nilekani as chairman of infosys,0
plilladher stock bet this q1 earn season,0
"buy reliance industries, infosys, engineer india: sukhani",0
infosys can touch rs 2200-2400: baliga,0
hold mphasis bfl: vasudeo,1
buy infosys; target rs 3145: firstcall research,1
strong quarterly revenue forecast for it firm,1
buy infosys technologies: motilal oswal,1
hold infosys technologies; target of rs 3298: krchoksey,0
"buy infosys, tata steel; sell kaveri seed: ashwani gujral",0
wipro have support at rs 540,0
hold infosys; target of rs 3150: anand rathi securities,1
software be the new hardware in cloud services: infosys,1
stay invest in infosys for 4 months to see rs 3100-3200,0
union budget 2015: need clarity on weight deduction on r&d spend for it:care,0
look at both small start-up type company & large ones for acquisition: wipro,1
"infy q2 result 'okay', cy12 budget key: cowen & co",0
comment: be indian investors gain from warren buffett€™s wisdom?,0
fy06 revenue guidance for progeon at $ 80mn,1
rally in the sensex not broad-based,0
infosys may announce $2.5 bn share buyback in april,0
xansa acquisition by steria: india focal point,1
infosys a better bet: vk sharma,1
"irani bullish on infosys, tcs",1
infosys launch assistedge for contact center,0
"buy infosys, say rajesh jain",1
"infosys top pick, say harendra kumar",1
margins to be under pressure for 12-18 months: infosys,0
see infosys fy16 eps at rs 57.5; $ rev at 9%: religare cap,1
new ceo likely for infosys in april,1
infosys sept qtr pat see up 8% at rs 1862 cr: pinc,0
accumulate infosys; target of rs 2573: angel broking,1
"bullish on infosys, target of rs 4065: jaideep goswami",0
buy infosys; target of rs 2650: angel broking,0
look for midcap in it space: manghnani,1
"reduce infosys, target rs 1710: iifl",0
"bullish on infosys, like mindtree: parag thakkar",1
"will lead industry growth, meet fy16 guidance: infosys",0
service sector growth slow to over 2-year low,0
"buy infosys, federal bank; short tata motor dvr: aditya agarwal",1
subprime crisis to hit hsbc's q3 nos,1
hold infosys tech: krchoksey,1
pick tcs closer to rs 920-930: sushil kedia,1
infosys may test rs 3600: ambareesh baliga,0
infosys q1fy13 pat see up 8% at rs 2500cr: kr choksey,0
infosys announce acquisition of us firm wongdoody hold for $75 million,1
sell infosys at current level: mehta,0
"buy infosys, target of rs 2400: deutsche bank",0
infosys & ibm set benchmark for core bank transaction,1
facebook to replace infosys on nasdaq 100 next wednesday,1
"buy mindtree, infosys: sudarshan sukhani",0
slowdown in us growth unlikely to impact indian it cos: ubs,0
infosys have target of rs 2300,1
tcs beat infy in q3; expect 2011 to be better than 2010,0
infosys q1 net see down 4.8% to rs 3423.3 cr: icicidirect,1
vemuri exit: infosys continue to lose senior talent,1
pretty good time for tech sector: dutt,1
"tulsian's take on trident, igl, century textiles & other stock",1
tcs expect to grow 2%;infy stock may re-rate further:edelweiss,1
infosys have support around rs 2750: kulkarni,1
ambit cap may up infosys eps estimate on strong rev growth,0
"buy infosys technologies, say sukhani",0
"infosys, hcl, wipro look weak in it space: sharma",1
"buy infosys, say sudarshan sukhani",1
"infosys an outperformer, target of rs 2517: karvy",0
"hold infosys, target of rs 1880: sharekhan",0
wipro go shop to us; buy cmango,1
accumulate infosys technologies: parag parikh,1
6 stock that should do well today,0
"infosys jun qtr pat see at rs 1,434 cr: sharekhan",1
"infosys warn of weak q3 margins, maintain fy16 guidance",1
buy infosys; may give 35-40% returns: edelweiss,0
opm up despite re touch 9-yr high in q2: infy,1
ajai chowdhry be dataquest it person of the year 2007,1
"above rs 2240, infosys can go upto rs 2340-2380: bose",0
infosys q2 net profit see down 1.1% at rs 1509.4cr,1
invest in infosys: p phani sekhar,0
"prefer infosys, hcl technologies on dips: sukhani",0
accumulate infosys; target of rs 3250: emkay,1
"buy infosys around rs 2300, say sunidhi securities",0
"tcs may move to rs 2650, say gaurang shah",0
infosys may outperform: sudarshan sukhani,0
infosys have target of rs 3450-3600,0
jetsynthesys invest usd3 mn in 'garage' facility for start-ups,1
buy infosys; target of rs 2527: pl,1
infosys technologies a safe stock,1
book profit in tcs: siddharth bhamre,1
it industry do not need tax exemption: narayana murthy,1
infosys not face any major price pressure: bg srinivas,0
"pick wipro, avoid infosys: chandan taparia",1
"see 5-7% upside in infosys, say ashu madan",0
"buy infosys, target of rs 2079: krchoksey",1
infosys have resistance at rs 2040-2050: bose,1
"buy, sell, hold: 7 stock to focus as market cautious",0
edelweiss list 4 stock you should bet on post result,0
wait get longer for it hire as slowdown bite,0
infosys buy nz gen-i's software solutions biz,1
infosys dec qtr pat see at rs 1186 cr: i sec,1
infosys could slip to about rs 3140-3150: jatinder sharma,1
infosys enter hospitality arena,0
"infosys may retain fy17 revenue guidance, q1 profit see down 4%",1
major events in my life link to milestones at infy: kris,0
"infosys, tcs, hdfc among 17 indian firm in forbes best 'regarded' cos list",0
infosys to meet constant currency guidance of 10-12%: katri,1
buy infosys; target of rs 3225: motilal oswal,0
infosys likely to achieve 12% growth in fy14: kotak instl,0
infosys will beat conservative $ guidance: antique broking,0
hold infosys; target of rs 845: icici direct,0
look at it stocks: sudarshan sukhani,0
infosys can touch rs 3450,1
infosys hopeful of meet $20 bn target by 2020: sikka,1
buy infosys; target of rs 3650: motilal oswal,0
infosys technologies have support at rs 1970,0
super six stock you can bet on august 19,1
"sell unite breweries, shriram transport; buy infosys: sukhani",0
desai bullish on technology sector,1
"prefer eicher motors, infosys: gaurang shah",1
"see limit return from tcs, prefer infosys: edelweiss",1
"see upside in tcs, infosys: mayuresh joshi",1
"infosys q2 net up 1.5%, up fy14 guidance to 9-10%",0
"buy hcl tech, hexaware technologies: mitesh thacker",1
"prefer infosys, hcl technologies, tcs: mayuresh joshi",0
stay invest in infosys,0
rnrl have support at rs 123: bose,0
reliance have target of rs 1230,1
salil parekh's appointment be a positive development for infosys: expert,0
analysts wrong foot by infosys earnings€¦yet again,1
"buy havells, infosys: sudarshan sukhani",0
infosys sept qtr pat see up 13% at rs 1945 cr: emkay,0
"infosys, tcs may see 10-15% upside: jani",0
bse it index up over 7% post infosys up fy13 guidance,0
infosys top goal attainment index,1
opportunities in adversity: pinc research,0
visa violation probe: us senate sub-committee hold hear,1
exclusive interview: infosys on its q2 result,1
"hold infosys, say puneet kinra",0
"buy tcs, wipro, infosys: sudarshan sukhani",0
"sell wockhardt, tata motors; buy infosys: ashwani gujral",0
"buy infosys, wipro, tech mahindra, mindtree: p lilladher",0
super six stock you can bet on april 01,0
expect infosys to bounce back in fy14: antique broking,1
"now, infosys slip out of top 10 bse m-cap list",0
infosys may retest rs 2300: manghnani,1
"buy infosys, igl; sell hpcl: ashwani gujral",1
"hcl tech may test rs 1900, say mayuresh joshi",1
us h1b visa cap: it cos hit hardest,0
buy infosys; target of rs 3350: systematix,0
"sell infosys, buy infinite computer: gepl capital",0
"initiate long position in infosys, say amit gupta",0
infosys likely to trade between rs 2880-2980: iifl,1
infosys turn 25; cash bonanza for employees,0
'scam' to make 2013 a promise year for it-bpo sector,0
infosys have target of rs 3150: pankaj kapoor,1
look for buyouts in digital; shelve buyback plan: infy,1
why vishal sikka's non-it service background isn't a worry,1
"nortel contribute 0.5% rev, owe $4m: infosys",1
"road ahead for infy, it sector now",0
"buy ntpc, infosys; sell castrol india: sudarshan sukhani",0
infosys: re play party pooper,0
"it, pharma stock may outperform: sukhani",1
infosys q3 net may rise 5.1% at rs 2760.9cr: motilal oswal,0
infosys finacle launch solutions for payments bank and small finance bank,0
"kamdar bullish on infosys, tcs, hcl tech",1
infosys partner google cloud to develop 'data native intelligent enterprise',1
nandan nilekani return as chairman of infosys: read the full company statement,0
"mukesh ambani, bharti airtel win ibla'07 award",0
here be some stock ideas from deven choksey,1
kiran mazumdar-shaw back ravi venkatesan,1
railways give an infy kind of guidance this year,1
"tulsian see nifty at 6100, bet on bank & it",0
infosys q4 pat see up 2.7% at rs 2434cr: nirmal bang,1
"infosys, australian open announce strategic technology partnership",1
infosys q4 pat see up 0.5% at rs 2889 cr: dolat capital,0
infosys q3 pat see up 15% at rs 2197 cr: angel,1
infosys reject claim of hire discrimination in us,1
infosys may slip below rs 3000: kunal bothra,0
infosys approve 1:1 bonus issue,0
"prefer infosys, hexaware technologies: ajay bodke",0
"buy infosys 1060 call, advise krish subramanyam",1
satyam may go upto rs 720,0
"buy infosys 1140 call, say vk sharma",1
buy infosys; target of rs 3920: plilladher,1
"anu jain's view on tcs, infosys",1
super six stock you can bet on august 5,0
global ops will boost biz growth in fy16: tech mahindra,0
"infosys consolidate december 2018 net sales at rs 21,400.00 crore, up 20.27% y-o-y.",0
win large deal key for it company in 2018: v balakrishnan,0
infosys' q4 consolidate pat up at rs 2992cr,1
"strong q1, re depreciation help up fy07 guidance: infy",1
k v kamath relinquish icici bank post,1
infosys have support at rs 2620: mohindar,0
infosys q2 pat see up 2.8% to rs 3532.7 cr: icici sec.,1
infosys q3 net rise 6% at rs 983cr,0
jai bala's view on infosys,0
infosys may move to rs 2135-2150: hemant thukral,1
"invest in infosys, avoid midcap it space: ashish kyal",0
"buy hcl technologies, infosys: ts harihar",1
akshaya patra host zero to billion conclave in bangalore,1
infosys can go upto rs 3050: rajesh satpute,1
"buy infosys, advise sudarshan sukhani",1
infosys can touch rs 3060 before result,0
"infosys' q2 result on october 10, 2014",1
"buy pipavav defence, sadbhav engineering, jet airways: gujral",0
how euro depreciation impact indian company,1
"donï¿½t worry, tech look good in long term",1
"sp tulsian cautious on infosys, tech mahindra",0
how will infosys fair in q1fy11?,1
bullish on spicejet; upbeat on yes bank q3 result: tulsian,1
buy it stock on corrections: ambareesh baliga,0
infosys can go upto rs 2180,0
"negative on tcs, hcl tech; positive on infosys: bhamre",0
"infosys bag deal from kone, to set up helsinki design centre",1
infosys bag 4-year contract from toyota motor europe,1
sebi to look afresh into governance-related complaints at infosys,0
indian bpos to set shop in philippines ?,1
infosys win work placement of the year,0
infy guidance to be lower due to rupee appreciation,0
"buy infosys 2600 put, sell 2500 and 2400 put: trivedi",1
wait & watch approach in tech space: malik,0
infosys file f3 with sec; co say not look at adr sale,0
"buy infosys, recommend saurabh mukherjea",1
axon deal to raise our sap-based solutions abilities: infy,1
"tcs q4 net up 22% yoy to rs 3,597cr on higher other income",1
buy infosys technologies: karvy,1
it firm may report moderate growth in jan-mar,1
infosys q4 pat may dip 9% at rs 2621 cr: motilal oswal,0
cognizant ring nasdaq open bell from chennai,0
buy infosys technologies; target of rs 3200: iifl,1
"comparative analysis of infosys, wipro",1
largecap tech stock safer at current level,0
infosys rank no.1 offshore service provider,1
jitendra sriram neutral on infosys,0
"sell infosys, hcl tech; icici bank may test rs 210: rajat bose",1
change of guard in it biz; tcs be new bellwether: experts,1
"hold infosys, recommend sudarshan sukhani",1
"turbulent time for infosys over, buy on declines: akash jain",0
buy infosys; target of rs 1210: centrum,1
infosys worth buying: sukhani,0
"see further gain in infosys, tcs: karun mutha",1
infosys re-investigation find no wrongdoing in rajiv bansal severance pay case: kiran mazumdar-shaw,0
"adani ports, tcs, infosys among forbes super 50 list",0
infosys complete smart ofs solution project at ftsi,1
"see 15% upside in tcs, infosys: sanjiv bhasin",1
buy infosys 3450 call; sell 3500 call: bhavin desai,0
infosys likely to beat guidance with better volumes,1
taher badshah overweight on it space,0
stay away from technology stocks: sudarshan sukhani,0
appreciate re to hit fy11 margins by 150 bps: infosys,0
short larsen & toubro: vayalar,1
short infosys: edelweiss,1
trade infosys 1200 call; positive on tcs: chandan taparia,0
16 stock you should buy in fall market: pinc,1
unclear on h1b but see trump to be biz-friendly: vishal sikka,1
"reduce infosys, target of rs 1710: iifl",1
sell infosys fut between rs 3130-3140: iifl,0
nischal maheshwari positive on infosys,0
"buy infosys, say kunal bothra",1
tcs to announce q4 result on apr 16; infy to follow,1
buy infosys above rs 3350: abhijit paul,0
wipro can go upto rs 600-610,1
"road ahead not easy, infosys ceo sikka tell employees",1
infosys' us concall,0
tcs gain 10% in sept: be it time to exit? experts analyse,0
infosys to consider proposal for share buyback,1
"prefer tech mahindra, infosys, hexaware: ajay bodke",0
exit infosys technologies at rs 3300: sp tulsian,0
infosys q1 revenues see down 5% to rs rs 5344 cr,0
reliance may test rs 995-1000 levels: sharma,0
"pick infosys, say sudip bandyopadhyay",1
hold infosys tech; target of rs 3100: bonanza,1
"buy tcs at current level, say sukhani",1
"buy lic housing; sell infosys, niit technologies: ashwani gujral",1
infosys edge win nasscom business innovation,1
margins to remain above 31.5%: infosys,0
buy infosys around rs 2800-2850: nooresh mirani,1
"buy infosys, tcs: sudarshan sukhani",0
infosys q1 net profit up 17.9% at rs 794cr,1
"buy infosys, say sudarshan sukhani",0
"buy infosys 2150 put, say gaurav bissa",1
buy infosys with a price target of rs 3700; emkay research,1
axon counter offer: options for infosys,1
guidance not conservative: narayana murthy,0
"buy infosys, tgt rs 2084: hdfc securities",1
hold infosys; target of rs 955: icici direct,0
tech mahindra to set up healthcare unit with $94 mn deal,1
infosys q2 results: focus shift back to business,0
sell infosys: ventura,1
"bullish on infosys, will buy pharma on weakness: idfc sec",1
here be some trade bet from mehraboon irani,1
bfsi growth drive by global brand: infosys,1
"banking, fin service segment ahead of co's overall growth: tcs",1
"infosys value buy, say parag thakkar",0
infosys will give positive surprise tomorrow,0
tech sector a momentum play before result announcement,0
"infosys may go to rs 3450, say siddharth bhamre",0
super six trade ideas for the day,1
infosys good bet for the next 4-6 weeks,0
technology space will remain firm: d'souza,1
